ASIN,Title,Subtitle,Brand,Feature Bullets,Price,Is New,Is Prime,Recommended Retail Price,Ratings Total,Rating Average,Best Seller Rankings,One Star Ratings Count,Two Star Ratings Count,Three Star Ratings Count,Four Star Ratings Count,Five Star Ratings Count,Technical Specifications,URL,Categories,In Stock,Stock Level,Availability Message,Weekly Unit Sales,Monthly Unit Sales,Annual Unit Sales
B0CVM8TXHP,"iRobot Roomba Vac Robot Vacuum (Q0120) - Easy to use, Power-Lifting Suction, Multi-Surface Cleaning, Smart Navigation Cleans in Neat Rows, Self-Charging, Alexa Roomba Q0120",Visit the iRobot Store,iRobot,"DUST IS NO MATCH FOR OUR 3-STAGE CLEANING SYSTEM. Your chore list just got shorter. The Roomba Vac Essential robot is a vacuum loaded with cleaning essentials and powered by iRobot OS. Its 3-Stage Cleaning System has three levels of powerful suction for a custom clean on carpets and hard floors.; NAVIGATES YOUR HOME LIKE A PRO​. The smart navigation methodically cleans in neat rows, while sensors help it navigate around furniture and avoid falling down stairs.; READY TO TACKLE DIRT RIGHT OUT OF THE BOX. Straight out of the box, it's easy to use. It only takes a few minutes to set up your robot and start cleaning.; THOUGHTFULLY DESIGNED TO SIMPLIFY CLEANING​. The iRobot Home App simplifies your life with features like Clean While I'm Away, suggested cleaning schedules, and a Clean Map report so you know where your Roomba Vac Essential robot cleaned, even if you weren't home to see it.; SMALL, SMART, AND ON A MISSION TO CLEAN. The sleek, low-profile design means it can slide into tighter spots and grab dust and dirt under beds and sofas, while the Edge-Sweeping Brush gets into your edges and corners.; RECHARGES ITSELF SO YOU DON'T HAVE TO. Cleans for up to 120 minutes on a single charge and when its battery is low, this smart robot automatically returns to its charging station to recharge.; THE POWER YOU NEED FOR THE CLEAN HOME YOU WANT​. Wall to wall, corner to corner. This is comprehensive cleaning your way. With 3 power levels, choose a quieter cleaning or a more powerful vacuum.; ​ EXTRA DIRT? SPOT CLEANING IS ON IT. Easily target the places where your floors need extra attention. With spot cleaning, your robot spins in place, cleaning in one spot for up to 2 minutes.; FOR PROPER SETUP & OPERATION. The Roomba Vac Essential robot requires a 2.4 GHz network for setup and operation. After setup, keep your robot on 2.4GHz for operation; your phone can return to 5GHz.",,True,False,,49337,4.3,,2960,1480,3453,7893,33055,"Brand: iRobot; Model Name: Essential Vac; Special Feature: Edge Cleaning, Auto-Docking; Color: Black; Product Dimensions: 13""L x 13""W x 3.15""H",https://www.amazon.com/iRobot-Roomba-Robot-Vacuum-Q0120/dp/B0CVM8TXHP,Home & Kitchen; Vacuums & Floor Care; Vacuums; Robotic Vacuums,True,2.0,In Stock,467.0,1868.0,22416.0
B0D87G9YYF,"Robot Vacuum and Mop Combo, 2 in 1 Mopping Robotic Vacuum with Schedule, App/Bluetooth/Voice, Max Suction 3200Pa, Self-Charging Robot Vacuum Cleaner, Slim, Ideal for Pet Hair, Hard Floor, Carpet Black",Brand: XIEBro,XIEBro,"🤖🧹【2-in-1 Robot Vacuuming+Mopping】 T8S Robot vacuum and mop combo combination can quickly remove dust, paper scraps, and pet hair.Equipped with 300ml dust box and 260ml water tank as well as a roller brush. The electronically controlled water tank has 2-speed water outlet modes, and the penetration is uniform, which is suitable for all hard floors. The water output can be precisely controlled by an App or remote control. The 300ml dust box can hold more garbage, and the powerful suction motor with the roller brush can make vacuuming easier. Dry and wet two washes, meet different cleaning needs, and completely free your hands.; 📱🗣️【APP＆Remote Intelligent Control&Voice】 The T8S robot vacuum and mop can be controlled through the remote control and Tuya Smart APP. Many functions such as cleaning direction, mode switching, suction adjustment, and schedule setting can be easily realized through the Tuya Smart APP. The robot vacuum is also compatible with Google Assistant and supports voice intelligence control. After connecting to the Tuya Smart APP, the robot vacuum can be controlled by voice for cleaning tasks.(⚠The APP only supports 2. 4GHz Wi-Fi, not applicable for 5G Wi-Fi.); 🔋⚡【120min Runtime & Automatic Charging】 The T8S robot vacuum cleaner has a built-in 2600mAh lithium battery, 120 minutes in quiet mode, 90 minutes in standard mode, and 70 minutes in maximum mode, and the maximum cleaning area can reach 1290ft². Suitable for a variety of home types. When the battery is low by less than 15% or cleaning is complete, the robot vacuum cleaner will automatically return to the charging dock to charge.; 🗺️🤸【Intelligent Obstacle Avoidance Upgraded Again】 The robot vacuum has an advanced 3D precise obstacle avoidance function, and a full set of infrared sensors can intelligently identify and avoid white walls, stairs, and obstacles. The robot vacuum cleaner can climb up to 15° and can easily cross door thresholds or carpets. A 3.27'' slim design helps the robot vacuum cleaner to reach every corner of a house or narrow space, clean leftover dirty areas, and keep your house neat.; 🧼👍【Multiple Cleaning Modes ＆ Easy to Use】 Robotic vacuum cleaner offers 3 clean modes including ➊Auto cleaning ➋Spot cleaning ➌Edge cleaning. With the Tuya Smart App or the remote control, you can switch freely between different modes and power levels. Simple operation, parents and elders can also be easily manipulated.; 🌀🔄【3-Point＆3 Levels of Suction Adjustment】 T8S robotic vacuum cleaner is powered by a strong digital motor. The maximum suction power can reach 3200Pa, with 3 levels of adjustable suction power, with a carpet booster function, suitable for tile, wood floor, carpet, marble, and other different floors. The dust box is equipped with 3-layer filter system, A High-performance filter efficiently filters dust and fine particles and removes dirts. Bilateral brush can quickly gather and absorb large particles and fine dust.; 📦🤖【What You Get】 T8S Vacuum Robot, Remote Control (2 AAA batteries included), Charging Base, Power Adapter, Water Tank, Dustbin, 4 Side Brushes, User Manual. Professional customer service and 12-month warranty.",149.99,True,True,499.99,1901,4.2,Home & Kitchen (Rank: 14780); Robotic Vacuums (Rank: 20),190,95,133,190,1311,"Brand: XIEBro; Model Name: T8S Robot Vacuum and Mop Combo; Special Feature: Wet/Dry, Edge Cleaning, Simultaneous Vacumming & Mopping, Anti-Fall, Scheduling; Color: Black; Product Dimensions: 16.9""L x 13.97""W x 4.64""H; Customer Reviews: 4.2    4.2 out of 5 stars         1,901 ratings          4.2 out of 5 stars; Best Sellers Rank: #14,780 in Home & Kitchen (See Top 100 in Home & Kitchen) #20 in Robotic Vacuums; ASIN: B0D87G9YYF; Style Number: T8S Robot Vacuum and Mop Combo; UPC: 768771338882; Brand Name: XIEBro; Included Components: 1x Charging Dock, 1x User Manual,1x Remote Control, 1x Watertank(With Washable Mopping Cloth), 2x Side Brush 1x T8S Robotic Vacuum, 1x Power Adapter; Power Source: Battery Powered; Batteries are Included: Yes; Voltage: 220 Volts; Capacity: 560 Milliliters; Compatible Devices: Smartphones, Google Home; Form Factor: Robotic; Control Method: App, Remote, Touch, Voice; Filter Type: Three-layer high-efficiency filtration (washable) + filter cotton (not washable); Battery Life: 1000 Hours; Battery Type: Lithium Ion; Surface Recommendation: Hard Floor,Low Pile Carpet, Wood Floor, Tile Floor; Special Features: Wet/Dry, Edge Cleaning, Simultaneous Vacumming & Mopping, Anti-Fall, Scheduling; Controller Type: App Control，Remote control，Voice Control; Item Dimensions L x W x H: 16.9""L x 13.97""W x 4.64""H",https://www.amazon.com/Robot-Vacuum-Mop-Combo-Self-Charging/dp/B0D87G9YYF,Home & Kitchen; Vacuums & Floor Care; Vacuums; Robotic Vacuums,True,445.0,In Stock,307.0,1228.0,14736.0
B07R295MLS,"eufy Robot Vacuum 11S MAX, Super Thin, Powerful Suction, Quiet, Self-Charging Robotic Vacuum Cleaner, Cleans Hard Floors to Medium-Pile Carpets, Black",Visit the eufy Store,eufy,"Compact and Quiet Operation: With a slim 2.85"" profile, the eufy robot vacuum operates quietly, offering a comprehensive clean without causing a disturbance, making it perfect for use at any hour.; Extended Cleaning Performance: Capable of running up to 100 minutes on hardwood floors, the eufy vacuum robot provides powerful, consistent suction for a thorough clean at a noise level similar to a microwave.; Intelligent Cleaning Power: The eufy robot vacuum's BoostIQ Technology automatically increases suction power within 1.5 seconds when needed, ensuring top performance on a variety of surfaces.; Superior Protection and Efficiency: The eufy robot vacuum comes with an anti-scratch tempered glass-top cover, infrared-sensor for evading obstacles, and drop-sensing tech, ensuring a safe, efficient clean while self-recharging to stay ready.; What You Get: RoboVac 11S MAX, remote control (2 AAA batteries included), charging base, AC power adapter, cleaning tool, 1 side brush, user manual, and our worry-free 12-month warranty.",195.99,True,True,249.99,66553,4.3,Home & Kitchen (Rank: 787); Robotic Vacuums (Rank: 3),4658,2662,4658,10648,43924,"Brand: eufy; Model Name: eufy 11S Max; Special Feature: Super-Thin, Quiet, Self-Charging; Color: Black; Product Dimensions: 12.79""L x 12.79""W x 2.85""H; Included Components: 1 x Robotic vacuum cleaner, 1x Cleaning tool&Side brush, 1 x Remote control, 1 x User manual&Warranty Information, 1x Charging base&Power adapter; Filter Type: washable; Battery Life: 100 minutes; Voltage: 240 Volts; Capacity: 600 Milliliters; Power Source: Battery Powered; Are Batteries Included: Yes; Control Method: Remote; Compatible Devices: remote control; Form Factor: Robotic; Global Trade Identification Number: 00848061058475; UPC: 848061058475; Item Weight: 6.34 pounds; Manufacturer: eufy; ASIN: B07R295MLS; Country of Origin: China; Item model number: AK-T2126111; Batteries: 1 Lithium Ion batteries required. (included); Customer Reviews: 4.3    4.3 out of 5 stars         66,553 ratings          4.3 out of 5 stars; Best Sellers Rank: #787 in Home & Kitchen (See Top 100 in Home & Kitchen) #3 in Robotic Vacuums; Specific instructions for use: dual action, hard floor, carpet; Maximum recommended load: 6 Pounds; Warranty Description: 12 month warranty.; Batteries required: Yes",https://www.amazon.com/eufy-Super-Thin-Super-Strong-Self-Charging-Medium-Pile/dp/B07R295MLS,Home & Kitchen; Vacuums & Floor Care; Vacuums; Robotic Vacuums,True,1.0,Only 1 left in stock - order soon.,2396.0,9584.0,115008.0
B0CNKX4429,"iRobot Roomba Vac Robot Vacuum (Q011) - Power-Lifting Suction, Alexa, Quieter Cleaning Mode, Multi-Surface Cleaning, Cleans in Neat Rows, Easy to use, Self-Charging Roomba Q011 Amazon Exclusive",Visit the iRobot Store,iRobot,"DUST IS NO MATCH FOR OUR 3-STAGE CLEANING SYSTEM. Your chore list just got shorter. The Roomba Vac Essential robot is a vacuum loaded with cleaning essentials and powered by iRobot OS. Its 3-Stage Cleaning System has three levels of powerful suction for a custom clean on carpets and hard floors.; NAVIGATES YOUR HOME LIKE A PRO​. The smart navigation methodically cleans in neat rows, while sensors help it navigate around furniture and avoid falling down stairs.; READY TO TACKLE DIRT RIGHT OUT OF THE BOX. Straight out of the box, it's easy to use. It only takes a few minutes to set up your robot and start cleaning.; THOUGHTFULLY DESIGNED TO SIMPLIFY CLEANING​. The iRobot Home App simplifies your life with features like Clean While I'm Away, suggested cleaning schedules, and a Clean Map report so you know where your Roomba Vac Essential robot cleaned, even if you weren't home to see it.; SMALL, SMART, AND ON A MISSION TO CLEAN. The sleek, low-profile design means it can slide into tighter spots and grab dust and dirt under beds and sofas, while the Edge-Sweeping Brush gets into your edges and corners.; RECHARGES ITSELF SO YOU DON'T HAVE TO. Cleans for up to 120 minutes on a single charge and when its battery is low, this smart robot automatically returns to its charging station to recharge.; THE POWER YOU NEED FOR THE CLEAN HOME YOU WANT​. Wall to wall, corner to corner. This is comprehensive cleaning your way. With 3 power levels, choose a quieter cleaning or a more powerful vacuum.; EXTRA DIRT? SPOT CLEANING IS ON IT. Easily target the places where your floors need extra attention. With spot cleaning, your robot spins in place, cleaning in one spot for up to 2 minutes.; FOR PROPER SETUP & OPERATION. The Roomba Vac Essential robot requires a 2.4 GHz network for setup and operation. After setup, keep your robot on 2.4GHz for operation; your phone can return to 5GHz.",139.99,True,True,249.99,25251,4.1,Home & Kitchen (Rank: 630); Robotic Vacuums (Rank: 2),2272,1262,2272,4292,15150,"Brand: iRobot; Model Name: Essential Vac; Special Feature: Logical Navigation, Edge Cleaning, Eco Mode, Scheduling, Anti-Fall; Color: Black; Product Dimensions: 13""L x 13""W x 3.1""H; Included Components: Docking Station; Filter Type: Cartridge; Battery Life: 120 minutes; Power Source: Battery Powered; Are Batteries Included: Yes; Compatible Devices: Amazon Echo; Form Factor: Robotic; UPC: 885155041852; Item Weight: 13.2 pounds; Manufacturer: iRobot; ASIN: B0CNKX4429; Country of Origin: China; Item model number: Q011020; Batteries: 1 Lithium Ion batteries required. (included); Customer Reviews: 4.1    4.1 out of 5 stars         25,251 ratings          4.1 out of 5 stars; Best Sellers Rank: #630 in Home & Kitchen (See Top 100 in Home & Kitchen) #2 in Robotic Vacuums; Batteries required: Yes",https://www.amazon.com/iRobot-Roomba-Essential-Robot-Vacuum/dp/B0CNKX4429,Home & Kitchen; Vacuums & Floor Care; Vacuums; Robotic Vacuums,True,2.0,Only 2 left in stock - order soon.,2664.0,10658.0,127896.0
B0C4N37V2Z,"iRobot Roomba Combo i5+ Self-Emptying Robot Vacuum and Mop, Clean by Room with Smart Mapping, Empties Itself for Up to 60 Days, Works with Alexa, Personalized Cleaning OS",Visit the iRobot Store,iRobot,"POWERFUL PERFORMANCE. POWERFUL PICKUP. Pulls in the everyday dirt and debris with a 4-Stage Cleaning System, featuring unique Dual Multi-Surface Rubber Brushes that adjust to different floor types and avoid getting tangled with pet hair.; AUTOMATICALLY EMPTIES ITS BIN ON ITS OWN FOR UP TO 60 DAYS. Cleans up after itself, emptying its Vacuum Bin into an enclosed bag that holds up to 60 days of debris, which means two whole months of not thinking about vacuuming.; CLEANS THE ROOMS YOU WANT WHEN YOU WANT. Learns your home and creates an Imprint Smart Map so you can direct it to clean any room you want, any time you want—either on a set schedule or in the moment.; FOCUSES ON DIRT. Patented Dirt Detect Technology allows the Roomba Combo i5 plus robot to detect dirtier areas of your home and clean them more thoroughly when the Vacuum Bin is installed.; DOUBLE THE CLEAN WITH ONE MACHINE. The Roomba Combo i5 plus robot vacuum and mop is designed for both wet and dry floor cleaning—converting from an all-floor vacuum to a vacuum and mop, with the simple switch of a bin.; A MOP PAD DESIGNED FOR PERFORMANCE. Designed for wet floor mopping performance, the specialized microfiber pad tackles footprints, dirt and dust.; CLEAN YOUR WAY MORE EFFICIENTLY. Fill the Roomba Combo Bin’s tank with a compatible cleaning solution* of your choice or just water and instantly transform your robot into a vacuuming and wet mopping robot that leaves your home fresh and clean. *See iRobot website for list of compatible cleaning solutions.; UNDERSTANDS MORE VOICE COMMANDS THAN ANY OTHER 2-IN-1. Simply pair Roomba Combo i5 plus robot vacuum and mop with Alexa, Siri or Google Assistant-enabled devices* and tell it to clean the kitchen, living room, or every room.; COMPLETE CONTROL IN YOUR HANDS. iRobot OS works together with the iRobot Home app to make cleaning easier and more personalized—all with less effort, so you have more time to do the things you love.",299.0,True,True,549.99,19294,4.0,Home & Kitchen (Rank: 344); Robotic Vacuums (Rank: 1),2701,1157,1350,2894,11190,"Brand: iRobot; Model Name: Roomba Combo i5+; Special Feature: Smart Mapping, Clean by room, Cleans in neat rows, Self-Emptying; Color: Black; Product Dimensions: 13.4""L x 13.5""W x 3.6""H; Customer Reviews: 4.0    4.0 out of 5 stars         19,294 ratings          4.0 out of 5 stars; Best Sellers Rank: #344 in Home & Kitchen (See Top 100 in Home & Kitchen) #1 in Robotic Vacuums; ASIN: B0C4N37V2Z; Style Number: i557020; Global Trade Identification Number: 00885155040640; UPC: 885155040169 885155040640; Brand Name: iRobot; Included Components: 1 Roomba i5 Robot Vacuum, 2 Cleaning Pads, 1 Extra High-Efficiency Filter, 1 Roomba Combo Bin, 2 Dirt Disposal Bags, 1 Clean Base Automatic Dirt Disposal; Power Source: Battery Powered; Batteries are Included: Yes; Voltage: 14.4 Volts; Compatible Devices: Amazon Echo; Form Factor: Robotic; Control Method: Voice; Filter Type: Cartridge; Battery Life: 180 minutes; Battery Type: Lithium Ion; Surface Recommendation: Hardwood, Hardfloor, Carpet; Special Features: Smart Mapping, Clean by room, Cleans in neat rows, Self-Emptying; Controller Type: Amazon Alexa, Siri, Voice Control; Item Weight: 3.18 Kilograms; Item Dimensions L x W x H: 13.4""L x 13.5""W x 3.6""H",https://www.amazon.com/iRobot-Self-Emptying-Mapping-Personalized-Cleaning/dp/B0C4N37V2Z,Home & Kitchen; Vacuums & Floor Care; Vacuums; Robotic Vacuums,True,2.0,In Stock,4694.0,18778.0,225336.0
B08C6XGP4F,"Shark AV753 ION Robot Vacuum, Tri-Brush System, Wifi Connected, 120 Min Runtime, Works with Alexa, Multi Surface Cleaning, Grey Gray",Visit the Shark Store,Shark,"THREE BRUSH TYPES. ONE POWERFUL CLEAN: Tri-Brush System combines side brushes, channel brushes, and a multi-surface brushroll to handle debris on carpets and hard floors.; INTELLIGENT CLIFF SENSORS: Shark ION Robot senses ledges and stairs and avoids bumping furniture and walls.; CLEAN FROM YOUR PHONE: SharkClean app lets you start and stop cleaning and schedule your robot to clean whenever you want.; EASY VOICE CONTROL: Use Amazon Alexa or Google Assistant to easily make the robot clean at your command in your connected home.; 120 MINUTE RUNTIME: Whole-home, floor-to-carpet cleaning for up to 2 hours.; BUILT, TESTED, AND PERFECTED: Shark puts their robots through rigorous testing, performing thousands of hours of real-life use to give you a reliable, ultra-powerful clean.; WHAT'S INCLUDED: Shark ION Robot, Charging dock, (2) Side Brushes, & (1) Filter.",,True,True,,17985,4.1,,1798,899,1618,3057,10789,"Brand: Shark; Model Name: Works with Alexa, Multi-Surface Cleaning; Special Feature: robot vacuum; Color: Gray; Product Dimensions: 12.6""L x 12.4""W x 3.54""H",https://www.amazon.com/Shark-AV753-Connected-Runtime-Cleaning/dp/B08C6XGP4F,Home & Kitchen; Vacuums & Floor Care; Vacuums; Robotic Vacuums,True,1.0,Only 1 left in stock - order soon.,682.0,2730.0,32760.0
B08QZVSC8D,"Shark AV2501AE AI Robot Vacuum with XL HEPA Self-Empty Base, Bagless, 60-Day Capacity, LIDAR Navigation, Perfect for Pet Hair, Compatible with Alexa, Wi-Fi Connected, Carpet & Hard Floor, Black AI Dry",Visit the Shark Store,Shark,"INCREDIBLE SUCTION: Powerful Shark suction picks up dirt and debris on all floor types—tackling even the toughest of messes in your home.; NO SPOTS MISSED: With Matrix Clean Navigation, the vacuum cleans in a precise matrix grid taking multiple passes over dirt and debris for whole home, deep cleaning coverage.; IT EMPTIES ITSELF: The bagless, self-emptying base holds up to 60 days of dirt and debris while its true HEPA filtration captures and traps 99.97%* of dust and allergens (*down to .3 microns).; PRECISION HOME MAPPING: 360° LiDAR vision quickly and accurately maps your home so your robot can methodically clean detecting and avoiding objects in its path, day or night, adapting to everyday changes in the home.; PERFECT FOR HOMES WITH PETS: With powerful vacuum suction, Shark’s self-cleaning brushroll, and HEPA filtration system the robot captures pet hair, dust, dander and allergens with ease.; HANDS-FREE CONTROL: Set a cleaning schedule, initiate on-demand cleaning, or activate cleans all with sound of your voice using Amazon Alexa or Google Assistant.; EXTENDED RUNTIME: Up to 120 minutes of runtime for whole-home cleaning. And with Recharge and Resume, the robot will return to the dock, recharge, and can pick up where it left off.; BUILT, TESTED, AND PERFECTED: Shark puts their robots through rigorous testing to guarantee reliable, and high-quality performance.; WHAT’S INCLUDED: 1 Shark AI Ultra Robot, 1 XL HEPA Self-Empty Base, and 2 Side Brushes.",299.99,True,True,649.99,3372,4.2,Home & Kitchen (Rank: 5541); Robotic Vacuums (Rank: 10),370,134,202,505,2158,"Brand: Shark; Model Name: Shark AV2501AE; Special Feature: LiDAR Navigation, Bagless; Color: Black/Bronze; Product Dimensions: 13.08""L x 8.43""W x 13.9""H; Included Components: 2 Side Brushes, XL HEPA Filter, 1 Filter, Shark AI Robot, Self-Empty Base; Filter Type: Foam; Battery Life: 120 minutes; Power Source: Battery Powered; Are Batteries Included: Yes; Control Method: Voice; Compatible Devices: Amazon Echo, Google Home; Form Factor: Robotic; UPC: 622356574488; Item Weight: 15.25 pounds; Manufacturer: SharkNinja; ASIN: B08QZVSC8D; Country of Origin: China; Item model number: AV2501AE; Batteries: 1 Lithium Ion batteries required. (included); Customer Reviews: 4.2    4.2 out of 5 stars         3,372 ratings          4.2 out of 5 stars; Best Sellers Rank: #5,541 in Home & Kitchen (See Top 100 in Home & Kitchen) #10 in Robotic Vacuums; Finish types: Bronze; Assembly required: No; Number of pieces: 6; Warranty Description: 1 year limited warranty.; Batteries required: Yes",https://www.amazon.com/Shark-Mapping-Capacity-Bagless-AV2501AE/dp/B08QZVSC8D,Home & Kitchen; Vacuums & Floor Care; Vacuums; Robotic Vacuums,True,999.0,In Stock,854.0,3419.0,41028.0
B0D2XXSPCR,"Robot Vacuum and Mop Combo,4200Pa Powerful Robotic Vacuum Cleaner with Self-Charging, Home Automatic Robot Aspiradora for Hardwood Floor, Low Carpet, Pet Hair, App&Voice&Remote Control Obsidian Black",Brand: Tipdiy,Tipdiy,"【Double Clean with Vacuum and Mop】Automating the provision of dust-free floors and fresh air, Tipdiy G90 employs the most recent linkage-efficient cleantech of 2024 to collect commonplace dirt, dust, and footprints with an integrated system.; 【Hassle-free Smart Sensor】By leveraging intelligent detection and data processing technologies, the robot is capable of automatically avoiding obstacles, switching cleaning modes, avoiding hazardous drops, and recharging itself - all with less effort, so you have more time to do the things you love.; 【4200Pa Enhanced Cleaning】Benefit from an extensive and meticulous cleaning experience courtesy of the robotic vacuum's 4200Pa hyperForce Suction, which offers tailored strength for diverse cleaning scenarios.Designed for homes with pets, this robotic vacuum eliminates the hassle of manually clearing tangled and messy pet hair during daily cleaning routines.; 【Customize Your Cleaning】At your fingertips, feel free to define the mode, intensity, and time pattern you prefer to complete the whole-home cleaning on the phone. With verbal voice control, you can solve your cleanup tasks no matter what you're up to.; 【Extensive House Supported 】Equipped with a larger dustbin and powered by a high-capacity battery, the robot is capable of completing extensive cleaning tasks and can meet the needs of large families with multiple members.",139.89,True,True,149.99,64,4.9,Home & Kitchen (Rank: 2223); Robotic Vacuums (Rank: 6),1,0,0,0,62,"Brand: Tipdiy; Model Name: G90; Special Feature: Integrated Mopping and Vacuum Systerm, Powerful 4200Pa Suction, APP/Voice/Remote Control, Customize Cleaning Settings, Automatic Self-charging, Electronic Pumped Water Flow, Scheduling Cleaning, High Density Filtration; Color: Obsidian Black; Product Dimensions: 12""L x 12""W x 2.99""H; Included Components: Robotic Vacuum and Mop Cleaner, Mop Pad Holder, Charging Station, Power Adapter, Electrically Controlled Water Tank and Dust Collector, Mopping Pad Cloth, Spare HEPA filter, 4 Side brushes, Cleaning brush, User manual, APP instruction; Filter Type: Washable Multi-layer Filter; Battery Life: 120 minutes; Power Source: Battery Powered; Are Batteries Included: Yes; Compatible Devices: Smartphones, Amazon Echo, Remote Control, Google Home; Form Factor: Robotic; Item Weight: 4 pounds; Manufacturer: Tipdiy; ASIN: B0D2XXSPCR; Item model number: G90; Batteries: 1 Lithium Ion batteries required. (included); Customer Reviews: 4.9    4.9 out of 5 stars         64 ratings          4.9 out of 5 stars; Best Sellers Rank: #2,223 in Home & Kitchen (See Top 100 in Home & Kitchen) #6 in Robotic Vacuums; Date First Available: April 29, 2024; Special Feature: Integrated Mopping and Vacuum Systerm, Powerful 4200Pa Suction, APP/Voice/Remote Control, Customize Cleaning Settings, Automatic Self-charging, Electronic Pumped Water Flow, Scheduling Cleaning, High Density Filtration See more",https://www.amazon.com/Tipdiy-Powerful-Self-Charging-Automatic-Aspiradora/dp/B0D2XXSPCR,Home & Kitchen; Vacuums & Floor Care; Vacuums; Robotic Vacuums,True,999.0,In Stock,1585.0,6341.0,76092.0
