B081J646XW,"eufy BoostIQ RoboVac 11S MAX, Robot Vacuum Cleaner, Super Thin, Powerful Suction, Quiet, Self-Charging Robotic Vacuum Cleaner, Cleans Hard Floors to Medium-Pile Carpets, Black(Renewed)",Visit the Amazon Renewed Store,eufy,"1. Compact and Quiet Operation: With a slim 2.85"" profile, the eufy robot vacuum operates quietly, offering a comprehensive clean without causing a disturbance, making it perfect for use at any hour.; 2. Extended Cleaning Performance: Capable of running up to 100 minutes on hardwood floors, the eufy vacuum robot provides powerful, consistent suction for a thorough clean at a noise level similar to a microwave.; 3. Adaptive Suction Power for Different Surfaces: BoostIQ Technology adjusts suction within 1.5s for optimal cleaning on any surface.; 4. Superior Protection and Efficiency: The eufy robot vacuum comes with an anti-scratch tempered glass-top cover, infrared-sensor for evading obstacles, and drop-sensing tech, ensuring a safe, efficient clean while self-recharging to stay ready.; 5. What You Get: RoboVac 11S MAX, charging base, AC power adapter, cleaning tool,1 side brush, user manual, and our worry-free 12-month warranty.",129.99,True,False,195.99,734,4.3,Amazon Renewed (Rank: 2266); Renewed Home & Kitchen (Rank: 148); Robotic Vacuums (Rank: 297),58,22,44,124,477,"Brand: eufy; Model Name: T2126; Special Feature: boost intellect technology, logical navigation, automatic height adjustment, smart mapping; Color: Black; Product Dimensions: 12.79""L x 12.79""W x 2.85""H; Customer Reviews: 4.3    4.3 out of 5 stars         734 ratings          4.3 out of 5 stars; Best Sellers Rank: #2,266 in Amazon Renewed (See Top 100 in Amazon Renewed) #148 in Renewed Home & Kitchen #297 in Robotic Vacuums; ASIN: B081J646XW; Style Number: T2126; UPC: 766234255257; Brand Name: eufy; Included Components: Instruction Guide; Power Source: Battery Powered; Batteries are Included: Yes; Capacity: 0.6 Liters; Compatible Devices: /; Form Factor: Robotic; Control Method: Remote; Filter Type: Disk; Battery Life: 100 minutes; Battery Type: Lithium Ion; Surface Recommendation: Hard Floor; Special Features: boost intellect technology, logical navigation, automatic height adjustment, smart mapping; Controller Type: Remote Control; Item Weight: 5.95 Pounds; Item Dimensions L x W x H: 12.79""L x 12.79""W x 2.85""H",https://www.amazon.com/eufy-BoostIQ-Powerful-Self-Charging-Medium-Pile/dp/B081J646XW,Home & Kitchen; Vacuums & Floor Care; Vacuums; Robotic Vacuums,True,426.0,In Stock,,,
B0C415KNH8,"iRobot Roomba Combo i5 Robot Vacuum & Mop - Clean by Room with Smart Mapping, Works with Alexa, Personalized Cleaning Powered OS, Ideal for Pet Hair, Carpet and Hard Floors",Visit the iRobot Store,iRobot,"DOUBLE THE CLEAN WITH ONE MACHINE. The Roomba Combo i5 robot vacuum and mop is designed for both wet and dry floor cleaning—converting from an all-floor vacuum to a vacuum and mop, with the simple switch of a bin.; POWERFUL PERFORMANCE. POWERFUL PICKUP. Pulls in the everyday dirt and debris with a 4-Stage Cleaning System, featuring unique Dual Multi-Surface Rubber Brushes that adjust to different floor types and avoid getting tangled with pet hair.​; SIMULTANEOUSLY VACUUMS AND MOPS HARD FLOORS. Don't waste extra time cleaning, the Roomba Combo i5 robot vacuum and mop cleans wet or dry with one machine.; A MOP PAD DESIGNED FOR PERFORMANCE. Designed for wet floor mopping performance, the specialized microfiber pad tackles footprints, dirt and dust.; CLEAN YOUR WAY MORE EFFICIENTLY. Fill the Roomba Combo Bin’s tank with a compatible cleaning solution* of your choice or just water and instantly transform your robot into a vacuuming and wet mopping robot that leaves your home fresh and clean. *See iRobot website for list of compatible cleaning solutions​.; CLEANS THE ROOMS YOU WANT WHEN YOU WANT. Learns your home and creates an Imprint Smart Map so you can direct it to clean any room you want, any time you want—either on a set schedule or in the moment.; UNDERSTANDS MORE VOICE COMMANDS THAN ANY OTHER 2-IN-1. Simply pair Roomba Combo i5 robot vacuum and mop with Alexa, Siri or Google Assistant-enabled devices* and tell it to clean the kitchen, living room, or every room.; FOCUSES ON DIRT. Patented Dirt Detect Technology allows the Roomba Combo i5 robot to detect dirtier areas of your home and clean them more thoroughly when the Vacuum Bin is installed.; COMPLETE CONTROL IN YOUR HANDS. iRobot OS works together with the iRobot Home app to make cleaning easier and more personalized—all with less effort, so you have more time to do the things you love.; COMPATIBLE WITH THE CLEAN BASE AUTOMATIC DIRT DISPOSAL - Compatible with iRobot’s Self-Emptying Clean Base for up to 60 days of worry-free vacuuming.",229.0,True,True,349.99,13234,4.1,Home & Kitchen (Rank: 15937); Robotic Vacuums (Rank: 24),1588,794,926,1985,7940,"Brand: iRobot; Model Name: Roomba Combo i5; Special Feature: Smart Mapping, Cleans in neat rows, Cleans by room, Vacuum or vacuum & mop; Color: Neutral Gray; Product Dimensions: 13.4""L x 13.5""W x 3.6""H; Customer Reviews: 4.1    4.1 out of 5 stars         13,234 ratings          4.1 out of 5 stars; Best Sellers Rank: #15,937 in Home & Kitchen (See Top 100 in Home & Kitchen) #24 in Robotic Vacuums; ASIN: B0C415KNH8; Style Number: i517020; Global Trade Identification Number: 00885155040626; UPC: 885155040626; Brand Name: iRobot; Included Components: Mop Pad, Filter, Water Tank, Charging Adapter; Power Source: Battery Powered; Batteries are Included: Yes; Voltage: 14.4 Volts; Compatible Devices: Amazon Echo; Form Factor: Robotic; Filter Type: Cartridge; Battery Life: 180 minutes; Battery Type: Lithium Ion; Surface Recommendation: Hardwood, Hard Floor, Carpet; Special Features: Smart Mapping, Cleans in neat rows, Cleans by room, Vacuum or vacuum & mop; Controller Type: App Control, Button Control, Voice Control, iRobot Home App; Item Weight: 7 Pounds; Item Dimensions L x W x H: 13.4""L x 13.5""W x 3.6""H",https://www.amazon.com/iRobot-Roomba-Combo-Robot-Vacuum/dp/B0C415KNH8,Home & Kitchen; Vacuums & Floor Care; Vacuums; Robotic Vacuums,True,2.0,In Stock,299.0,1198.0,14376.0
B09J88GNW3,"Shark RV2502AE AI Ultra Robot Self-Empty Vacuum, Black XL HEPA Self-Empty Base",Visit the Shark Store,Shark,"INCREDIBLE SUCTION: Powerful Shark suction picks up dirt and debris on all floor types—tackling even the toughest of messes in your home.; NO SPOTS MISSED: With Matrix Clean Navigation, the vacuum cleans in a precise matrix grid taking multiple passes over dirt and debris for whole home, deep cleaning coverage.; IT EMPTIES ITSELF: The bagless, self-emptying base holds up to 60 days of dirt and debris while its true HEPA filtration captures and traps 99.97%* of dust and allergens (*down to .3 microns).; PRECISION HOME MAPPING: 360° LiDAR vision quickly and accurately maps your home so your robot can methodically clean detecting and avoiding objects in its path, day or night, adapting to everyday changes in the home.; PERFECT FOR HOMES WITH PETS: With powerful vacuum suction, Shark’s self-cleaning brushroll, and HEPA filtration system the robot captures pet hair, dust, dander and allergens with ease.; HANDS-FREE CONTROL: Set a cleaning schedule, initiate on-demand cleaning, or activate cleans all with sound of your voice using Amazon Alexa or Google Assistant.; EXTENDED RUNTIME: Up to 120 minutes of runtime for whole-home cleaning. And with Recharge and Resume, the robot will return to the dock, recharge, and can pick up where it left off.; BUILT, TESTED, AND PERFECTED: Shark puts their robots through rigorous testing to guarantee reliable, and high-quality performance.; WHAT’S INCLUDED: 1 Shark AI Ultra Robot, 1 XL HEPA Self-Empty Base, and 2 Side Brushes.",454.89,True,False,599.99,3471,4.2,Home & Kitchen (Rank: 259385); Robotic Vacuums (Rank: 237),347,173,208,485,2290,"Brand: Shark; Model Name: AI Ultra; Special Feature: LiDAR Navigation, Self-Cleaning Brushroll, Edge Cleaning, Obstacle Avoidance, Bagless, Self-Emptying; Color: Black; Product Dimensions: 15.52""L x 11.59""W x 16.97""H; Customer Reviews: 4.2    4.2 out of 5 stars         3,471 ratings          4.2 out of 5 stars; Best Sellers Rank: #259,385 in Home & Kitchen (See Top 100 in Home & Kitchen) #237 in Robotic Vacuums; ASIN: B09J88GNW3; Style Number: RV2502AE; UPC: 622356574501; Brand Name: Shark; Included Components: XL HEPA Self-Empty Base, Shark AI Robot Vacuum, Side Brushes; Power Source: Battery Powered; Batteries are Included: Yes; Compatible Devices: Amazon Alexa, Google Home; Form Factor: Robotic; Control Method: Voice; Filter Type: Non-Washable Filter; Battery Life: 120 minutes; Battery Type: Lithium Ion; Surface Recommendation: Carpets & Hardfloors; Special Features: LiDAR Navigation, Self-Cleaning Brushroll, Edge Cleaning, Obstacle Avoidance, Bagless, Self-Emptying; Controller Type: App Control, Voice Control; Item Weight: 15.25 Pounds; Item Dimensions L x W x H: 15.52""L x 11.59""W x 16.97""H",https://www.amazon.com/Shark-RV2502AE-Self-Empty-Navigation-UltraClean/dp/B09J88GNW3,Home & Kitchen; Vacuums & Floor Care; Vacuums; Robotic Vacuums,True,18.0,Only 18 left in stock - order soon.,,,
B08P2T2NXH,"OKP Life K2 Robot Vacuum Cleaner 1800 mAh, Blue",Visit the OKP Store,OKP,"👩🏻‍🔬This OKP K2 robot vacuum cleaner is for your daily home clean.; 🤔Why OKP K2 no suction:Please make sure the robot is in HIGH running working mode,you could check out via OKP app.; 🧠4 Clean Modes Cater to Your Needs:Smart Vacuum Robot Cleaner supports 4 clean modes including ➊Auto clean➋Spot clean ➌Wall Follow clean ➍Manual clean.Freely switch between different modes and power levels as you want via app.; ♻Long Running Time & Self-charging:Robotic Vacuum Runtime of K2 is up to 100 minutes before automatically docking & recharging.(Low suction running mode).; 💡Smart App & Easy Control:You can easily create a home clean schedule, change the clean mode, and control the clean direction by using the OKP app. The auto vacuum cleaner robot is also work with Alexa and Google Assistant, allowing users make the robot start and stop the clean by voice commands. Use robots to save you time and energy!; ⚙FreeMove Technology 2.0:Equipped with upgraded 6D built-in anti-collision infrared sensors technology, OKP robotic vacuum clean your home in an efficient way. Leave you a clean house with lower power consumption than random path cleaning can achieve!; 😃Advantaged Brushless Suction Port-No Hair Entanglement Any More:This robotic vacuum cleaner powered by strong digital motor ,K2 features strong suction power and a unique inlet design which does not clog with pet's hair like other robot vacuums with a rotating brush.; ⚠Please read manual carefully before using the robot vacuum cleaner for home and hard wood floor.",89.98,True,True,189.99,14838,4.0,Home & Kitchen (Rank: 58576); Robotic Vacuums (Rank: 66),1632,890,1483,2670,8309,"Brand: OKP; Model Name: OKP K2; Special Feature: Anti-Collision; Color: Blue; Product Dimensions: 11.02""L x 11.02""W x 2.99""H; Customer Reviews: 4.0    4.0 out of 5 stars         14,838 ratings          4.0 out of 5 stars; Best Sellers Rank: #58,576 in Home & Kitchen (See Top 100 in Home & Kitchen) #66 in Robotic Vacuums; ASIN: B08P2T2NXH; Style Number: K2; Brand Name: OKP; Included Components: User Manual, Robot Vaccum, Charging Dock, Side Brush, HEPA; Power Source: Battery Powered; Batteries are Included: Yes; Voltage: 19.6 Volts; Capacity: 500 Milliliters; Compatible Devices: Amazon Echo, Google Home; Form Factor: Robotic; Control Method: App; Filter Type: Cartridge; Battery Life: 1  years; Battery Type: Lithium Ion; Surface Recommendation: Carpet; Special Features: Anti-Collision; Controller Type: App Control; Item Weight: 3.02 Kilograms; Item Dimensions L x W x H: 11.02""L x 11.02""W x 2.99""H",https://www.amazon.com/OKP-K2-Robot-Vacuum-Cleaner/dp/B08P2T2NXH,Home & Kitchen; Vacuums & Floor Care; Vacuums; Robotic Vacuums,True,187.0,In Stock,,,
B0DFZ2HMY8,"Shark Matrix Plus 2in1 Robot Vacuum & Mop with Sonic Mopping, Matrix Clean, Home Mapping, HEPA Bagless Self Empty Base, CleanEdge, for Pet Hair, WiFi, Black/Mocha, AV2630WA Wet and Dry Self-Empty + Mocha",Visit the Shark Store,Shark,"INCREDIBLE SUCTION AND SONIC MOPPING: First, it’s an ultra-powerful whole home vacuum on carpets and floors that empties its own dustbin. Second, it’s an ultra-powerful vacuum that sonic mops hard floors at the same time.; NO SPOTS MISSED: With Matrix Clean, the robotic vacuum cleans in a precision matrix grid taking multiple passes over dirt and debris delivering 30% better carpet cleaning*(*vs. RV2610WD single pass tested on level loop sand).; CLEANS EDGES & CORNERS: CleanEdge Detect uses blasts of air and corner recognition to remove debris from edges and corners pulling the debris into the cleaning path for 50% better edge cleaning* (*vs RV2610WD with CleanEdge turned off).; HEPA FILTRATION & ANTI ALLERGEN SEAL: True HEPA filtration captures and traps 99.97%* of dust and allergens (*down to .3 microns) in the base.; IT EMPTIES & CHARGES ITSELF: Holds up to 60 days of dirt and debris. The bagless base doesn’t require any additional purchase of disposal bags, and with Recharge & Resume, robot automatically will recharge and pick up cleaning where it left off.; TACKLE STUCK ON STAINS: Sonic Mopping scrubs hard floors 100x per minute and for extra deep cleaning initiate Matrix Mop in the app to get 50% better stain cleaning in targeted zones (vs. RV2001WD, modified IEC 62885-6).; SELF-CLEANING BRUSHROLL: Digs deep into carpets and directly engages hardwood floors pulling up debris, hair, and dirt from all surfaces in your home – engineered to pick up more hair and is anti-hair wrap.; PRECISION HOME MAPPING: 360° LiDAR vision quickly and accurately maps your home so your robot can methodically clean detecting and avoiding objects in its path, day or night, adapting to everyday changes in the home.; PERFECT FOR HOMES WITH PETS: With powerful suction, sonic mopping, and Shark’s self-cleaning brushroll, the robot picks up pet hair and eliminates stuck-on pet messes with ease.; WHAT’S INCLUDED: Shark Matrix Plus 2-in-1 Robot, XL HEPA Self-Empty Base, 1 Filter, 1 Side Brush, 2 Microfiber Reusable Mopping Pads, 12oz. Starter VACMOP Cleaning Solution",749.99,True,True,,3925,4.3,Home & Kitchen (Rank: 162566); Robotic Vacuums (Rank: 163),274,157,235,549,2669,"Brand: Shark; Model Name: Shark Matrix Plus 2in1 Robot Vacuum; Special Feature: Portable, Wet/Dry, Edge Cleaning, Bagless, Auto-Docking; Color: Black/Mocha; Product Dimensions: 21.4""L x 14.96""W x 5.69""H; Included Components: 12oz. Starter VACMOP Cleaning Solution, XL HEPA Self-Empty Base, 2 Microfiber Reusable Mopping Pads, 1 Filter, 1 Side Brush, Shark Matrix Plus 2-in-1 Robot; Filter Type: HEPA; Battery Life: 110 minutes; Voltage: 14.4 Volts; Power Source: Corded Electric; Are Batteries Included: Yes; Form Factor: Low-profile, disk-shaped design; UPC: 622356664394; Manufacture Year: 2024; Item Weight: 16.95 pounds; Manufacturer: SharkNinja; ASIN: B0DFZ2HMY8; Country of Origin: China; Item model number: AV2630WA; Batteries: 1 Lithium Ion batteries required. (included); Customer Reviews: 4.3    4.3 out of 5 stars         3,925 ratings          4.3 out of 5 stars; Best Sellers Rank: #162,566 in Home & Kitchen (See Top 100 in Home & Kitchen) #163 in Robotic Vacuums; Batteries required: Yes",https://www.amazon.com/Shark-Mopping-Mapping-CleanEdge-AV2630WA/dp/B0DFZ2HMY8,Home & Kitchen; Vacuums & Floor Care; Vacuums; Robotic Vacuums,True,1.0,Only 1 left in stock - order soon.,,,
B0CQ2PXQ8D,"OKP 2000Pa Robot Vacuum Cleaner, Scheduled Cleaning, Small, Quiet Robot Vacuum, WiFi/APP/Alexa, Automatic Self Charging Robotic Vacuums for Pet Hair, Hard Floor, Low Pile Carpet",Visit the OKP Store,OKP,"【WiFi Connectivity & Voice Control】 The WiFi connectivity is a great upgrade for the OKP vacuum cleaner robots, you can schedule cleanings from your phone APP or even use voice commands with Alexa. It’s like having a personal cleaning assistant! Emptying the trap is as easy as pushing a button!; 【2000Pa Cleaning System】 OKP robot vacuum, fortified with enhanced suction power, increases the cleaning efficiency by 30%. It proficiently vacuums all dust, pet hair, crumbs, and various debris on multiple surfaces such as hardwood floors, low-pile carpets, etc.; 【Small Body with Big Dustbox】 The compact body of the small aspiradora robot is designed for narrow spaces such as beds, sofas and corners. It also features a 500ml dust box accessed via the top, rather than turning the robot upside down to empty it, which is a much better design and makes the whole thing much easier！; 【Self-charging with Enhanced Signal】 The docking station with enhanced signal allows the robot to find the charging station faster. You don’t have to worry about it running out of juice and is always ready for the next sweep. If you want a smart, efficient vacuum that takes care of the cleaning, the OKP is a fantastic choice!; 【Tangle-free Design】 Pet hair vacuum cleaner is equipped with an advanced brushless nozzle and two side brushes to draw hair, debris and dust directly into the larger dust bucket. You don’t need to worry about the hair wrapped around the brush of the robot, ideal for families with pets.; 【Freemove 3.0 Technology】 A full suite of advanced sensors allow OKP floor vacuum to navigate under and around furniture, and along edges. Alexa robots are equipped with 3 sensors at the bottom, which will automatically change the cleaning route when reaching the edge of the stairs, allowing you to enjoy a hassle-free cleaning life.",159.08,True,True,,10,3.6,Home & Kitchen (Rank: 830357); Robotic Vacuums (Rank: 706),2,0,1,3,2,"Brand: OKP; Model Name: Robot Vacuum Cleaner; Special Feature: Anti-Collision, Edge Cleaning, Scheduling, Pet Hair Pick Up, Advanced Custom Cleaning; Color: Deep Blue; Product Dimensions: 11.02""L x 11.02""W x 3.14""H; Included Components: Batteries included; Filter Type: HEPA; Battery Life: 120 minutes; Voltage: 19.6 Volts; Capacity: 500 Milliliters; Power Source: Corded Electric; Compatible Devices: Smartphones, Amazon Echo, Google Home; Form Factor: Robotic; UPC: 780627997852; Item Weight: 6.75 pounds; Manufacturer: OKP; ASIN: B0CQ2PXQ8D; Country of Origin: China; Item model number: K31212; Batteries: 1 A batteries required. (included); Customer Reviews: 3.6    3.6 out of 5 stars         10 ratings          3.6 out of 5 stars; Best Sellers Rank: #830,357 in Home & Kitchen (See Top 100 in Home & Kitchen) #706 in Robotic Vacuums; Specific instructions for use: Anti-Fall Robot Vacuum Cleaner, APP Scheduling Pet Hair Vacuum Cleaner, Obstacle Avoidance Vacuum Cleaner, Auto-Docking Small Vacuum Cleaners, Pet Hair Pick Up Robotic Vacuums; Batteries required: Yes",https://www.amazon.com/OKP-Scheduled-Cleaning-Automatic-Charging/dp/B0CQ2PXQ8D,Home & Kitchen; Vacuums & Floor Care; Vacuums; Robotic Vacuums,True,1.0,Only 1 left in stock - order soon.,,,
B0D6V8W64C,"Robot Vacuum and Mop Combo, 5000Pa Robot Vacuum Cleaner with LIDAR Navigation, 3 in 1 Robot Vacuum Mop with Auto Carpet Boost, Self Charging, App/Voice Control, Ideal for Pet Hair,5 Maps Black",Brand: Laresar Clean,Laresar Clean,"🧹【𝟑 𝐢𝐧 𝟏 𝐑𝐨𝐛𝐨𝐭 𝐕𝐚𝐜𝐮𝐮𝐦 𝐚𝐧𝐝 𝐌𝐨𝐩】The robot vacuum cleaner combines sweeping, mopping, and vacuuming functions into one, providing you with a comprehensive cleaning solution for your home.; 🌀【𝐒𝐦𝐚𝐫𝐭 𝐌𝐚𝐩𝐩𝐢𝐧𝐠 𝐚𝐧𝐝 𝐍𝐨-𝐠𝐨 𝐙𝐨𝐧𝐞𝐬】The robot vacuum uses intelligent mapping technology to create a map of your home, allowing it to navigate efficiently and avoid obstacles. You can also set no-go zones to keep the robot away from areas you don't want it to clean, such as pet areas or delicate furniture.; 🌪️【𝐒𝐭𝐫𝐨𝐧𝐠 𝐒𝐮𝐜𝐭𝐢𝐨𝐧 𝐚𝐧𝐝 𝐌𝐮𝐥𝐭𝐢-𝐟𝐥𝐨𝐨𝐫 𝐂𝐥𝐞𝐚𝐧𝐢𝐧𝐠】The robot vacuum and mop combo has a powerful suction of up to 5000Pa, which can effectively clean carpets, hard floors, pet hair, and other debris. It also has a smart sensor that adjusts the suction strength according to the different floor types, ensuring thorough cleaning without damaging your floors.; 🔋【𝐇𝐢𝐠𝐡-𝐜𝐚𝐩𝐚𝐜𝐢𝐭𝐲 𝐁𝐚𝐭𝐭𝐞𝐫𝐲 𝐚𝐧𝐝 𝐋𝐨𝐧𝐠 𝐑𝐮𝐧𝐭𝐢𝐦𝐞】The robotic vacuum is equipped with a high-capacity battery that allows it to run for up to 180 minutes on a single charge. This means you can clean a large area of your home in a single session without having to worry about running out of power. It also has a low-noise operation, so you can enjoy a peaceful cleaning experience.; 📱【𝐀𝐩𝐩 𝐚𝐧𝐝 𝐕𝐨𝐢𝐜𝐞 𝐂𝐨𝐧𝐭𝐫𝐨𝐥】The automatic vacuum robot is compatible with both voice and app control. You can easily control it from anywhere in your home using the Laresar Clean app on your smartphone to set cleaning schedules, control the cleaning mode, and monitor the cleaning progress.; 💿【𝐄𝐚𝐬𝐲 𝐭𝐨 𝐔𝐬𝐞 𝐚𝐧𝐝 𝐂𝐥𝐞𝐚𝐧】The Laresar Clean robot vacuum is easy to use and set up. It has a simple control panel and a user-friendly interface, making it accessible to everyone. The robot also has a self-charging feature, so it can return to its charging dock automatically when the battery is low.; 💯【𝟏𝟎𝟎% 𝐖𝐨𝐫𝐫𝐲-𝐟𝐫𝐞𝐞 𝐖𝐀𝐑𝐑𝐀𝐍𝐓𝐘】Laresar Clean attaches great importance to product quality and the satisfaction of our customers. 2-year warranty service and lifetime technical support are promised. Laresar Clean's after-sales team is always at your service and has a quick response within 24 hours. Please feel free to let us know if you have any questions or suggestions about us. We strive to make you 100% satisfied. Thank you for choosing Laresar Clean.; 🎁【𝐀 𝐏𝐞𝐫𝐟𝐞𝐜𝐭 𝐆𝐢𝐟𝐭 𝐂𝐡𝐨𝐢𝐜𝐞】Mars01 robot vacuum cleaner is a great gift option for your family and friends. It takes the burden of repetitive daily cleaning off your shoulders and saves you more time to spend on life's entertainment. It is great for families with pets to help them clean up their pet hair. It can help the elderly and people with limited mobility such as people with disabilities to clean. It is suitable for families with large homes for comprehensive cleaning.; ⚠️【𝐖𝐡𝐲 𝟐.𝟒𝐆 𝐧𝐨𝐭 𝟓𝐆】Why do almost all current robotic vacuums only support 2.4G WIFI connections and not the latest 5G? Because 5G transmits information faster but is not stable enough, and the 2.4G band network is more stable than 5G, with better transmission across walls. Robotic vacuums, as a tool for automatic cleaning, need to roam automatically from room to room in the home and are very dependent on a stable network signal. If your home currently only has a 5G network, you can set up your router to separate out a separate 2.4G network without affecting the original 5G device.",199.99,True,True,,158,4.6,Home & Kitchen (Rank: 160933); Robotic Vacuums (Rank: 157),6,4,9,9,129,"Brand: Laresar Clean; Model Name: Mars01; Special Feature: Anti-Collision, 2.4GHz Wifi Only(5Gwifi requires special settings), Anti-Fall, 360-Degree Swivel, Advanced Custom Cleaning; Color: Black; Product Dimensions: 12.6""L x 12.6""W x 3.6""H; Included Components: Mopping System(Mop holder*1, Mop cloth*1), Mars01 Robot Vacuum Cleaner*1, 2-in-1 Dust Box & Water Tank*1, Charging Dock*1; Filter Type: HEPA Filters; Battery Life: 180 minutes; Capacity: 250 Microliters; Power Source: Battery Powered; Control Method: App, Touch, Voice; Compatible Devices: Smartphones, Amazon Echo, Tablets, Google Home; Form Factor: Robotic; Manufacture Year: 2024; Item Weight: 8.71 pounds; Manufacturer: Laresar Clean; ASIN: B0D6V8W64C; Country of Origin: China; Item model number: CRV2011; Batteries: 1 Lithium Ion batteries required. (included); Customer Reviews: 4.6    4.6 out of 5 stars         158 ratings          4.6 out of 5 stars; Best Sellers Rank: #160,933 in Home & Kitchen (See Top 100 in Home & Kitchen) #157 in Robotic Vacuums; Date First Available: June 12, 2024; Special Feature: Anti-Collision, 2.4GHz Wifi Only(5Gwifi requires special settings), Anti-Fall, 360-Degree Swivel, Advanced Custom Cleaning See more",https://www.amazon.com/Laresar-Clean-Cleaner-Navigation-Charging/dp/B0D6V8W64C,Home & Kitchen; Vacuums & Floor Care; Vacuums; Robotic Vacuums,True,474.0,In Stock,,,
