B0C7VMFRDZ,"roborock Q8 Max+ Robot Vacuum and Mop, Self-Emptying, Hands-Free Cleaning for up to 7 Weeks, Reactive Tech Obstacle Avoidance, 5500 Pa Suction, DuoRoller Brush, APP-Controlled Mopping, Black Q8 Max+(Black) Black",Visit the roborock Store,roborock,"[Automatic Self-Emptying]: Experience enhanced convenience with the Q8 Max+ Self-Emptying feature, featuring a 2.5L dust bag that allows for up to 7 weeks of cleaning without the need for manual dustbin changes.; [Tailor your Mopping]: Different floors and different rooms need different cleaning intensities. Choose how much mopping you want to use in-app, and even define how much to use in specific rooms around your home, from low-flow on stone to high-flow for grimy kitchens.; [Reactive Tech Obstacle Avoidance]: The robot vacuum navigates through your home effortlessly, employing Reactive Technology Obstacle Avoidance, ensuring a seamless and uninterrupted cleaning experience.; [Powerful Cleaning Performance]: Enjoy a deep and thorough clean with our robot vacuum's powerful 5500 Pa HyperForce Suction, complete with a Carpet Boost function for enhanced performance on carpets.; [Dual Rubber Brush Efficiency]: Introducing the DuoRoller Brush, the latest in Roborock’s cleaning technology, designed to enhance vacuuming performance on carpets, helping reduce hair tangles and providing a hassle-free cleaning experience.; [Precise Navigation for Customized Cleaning]: Optimize your cleaning routine with PreciSense LiDAR Navigation, enabling Quick Mapping, 3D Mapping, and Multi-Level Mapping for precise and efficient cleaning in any environment.; [Seamless Control Options]: Take full control of your robot vacuum with ease using our user-friendly mobile app or the convenience of voice commands, allowing you to tailor your cleaning experience to your preferences effortlessly.",659.99,True,True,819.99,3892,4.4,Home & Kitchen (Rank: 47085); Robotic Vacuums (Rank: 52),272,116,194,505,2763,"Brand: roborock; Model Name: Q8 Max+; Special Feature: APP-Controlled Mopping, DuoRoller Brush, Powerful 5500Pa Suction, Reactive Tech Obstacle Avoidance, Low Noise, Automatic Dust Collection, Multi-Directional Floating Brush, App Control: Variable Suction Control, Multi-Floor Mapping, No-Go Zone, Advanced Custom Cleaning, Scheduling; Voice Control, Pet Hair Pick Up, Works with Alexa, Auto-Docking, Anti-Fall, Cordless, Edge Cleaning, Simultaneous Vacumming & Mopping, Obstacle Avoidance, Precision Laser Mapping & Navigation, Self-Emptying; Color: Black; Product Dimensions: 19.17""L x 14.92""W x 14.45""H; Included Components: Batteries included; Filter Type: Washable Filter; Battery Life: 240 minutes; Voltage: 110 Volts; Capacity: 470 Milliliters; Power Source: Battery Powered; Are Batteries Included: Yes; Control Method: App, Touch, Voice; Compatible Devices: Smartphones, Amazon Echo, Google Home; Form Factor: Robotic; Global Trade Identification Number: 00195043003498; Item Weight: 17.9 pounds; Manufacturer: roborock; ASIN: B0C7VMFRDZ; Country of Origin: China; Item model number: Q8 Max+; Batteries: 1 Lithium Ion batteries required. (included); Customer Reviews: 4.4    4.4 out of 5 stars         3,892 ratings          4.4 out of 5 stars; Best Sellers Rank: #47,085 in Home & Kitchen (See Top 100 in Home & Kitchen) #52 in Robotic Vacuums; Batteries required: Yes; Special Feature: APP-Controlled Mopping, DuoRoller Brush, Powerful 5500Pa Suction, Reactive Tech Obstacle Avoidance, Low Noise, Automatic Dust Collection, Multi-Directional Floating Brush, App Control: Variable Suction Control, Multi-Floor Mapping, No-Go Zone, Advanced Custom Cleaning, Scheduling; Voice Control, Pet Hair Pick Up, Works with Alexa, Auto-Docking, Anti-Fall, Cordless, Edge Cleaning, Simultaneous Vacumming & Mopping, Obstacle Avoidance, Precision Laser Mapping & Navigation, Self-Emptying See more",https://www.amazon.com/roborock-Q8-Max-Self-Emptying-APP-Controlled/dp/B0C7VMFRDZ,Home & Kitchen; Vacuums & Floor Care; Vacuums; Robotic Vacuums,True,5.0,In Stock,,,
B0CVJ3K8FF,"iRobot Roomba Robot Vacuum and Mop Combo (Y0140) - Vacuums and mops, Easy to use, Power-Lifting Suction, Multi-Surface Cleaning, Smart Navigation Cleans in Neat Rows, Self-Charging, Alexa Roomba Y0140",Visit the iRobot Store,iRobot,"A COMPLETE CLEAN WITH OUR 4-STAGE CLEANING SYSTEM​. A powerful 4-Stage Cleaning System vacuums and mops in one pass with a special brush for edge cleaning so dust can't gather.; NAVIGATES YOUR HOME LIKE A PRO​. The smart navigation methodically cleans in neat rows, while sensors help it navigate around furniture and avoid falling down stairs.; READY TO TACKLE DIRT RIGHT OUT OF THE BOX. Straight out of the box, it's easy to use. It only takes a few minutes to set up your robot and start cleaning.; THOUGHTFULLY DESIGNED TO SIMPLIFY CLEANING​. The iRobot Home App simplifies your life with features like Clean While I'm Away, suggested cleaning schedules, and a Clean Map report so you always know where your Roomba Combo Essential robot cleaned, even if you weren't home to see it.; SMALL, SMART, AND ON A MISSION TO CLEAN. The sleek, low-profile design means it can slide into tighter spots and grab dust and dirt under beds and sofas, while the Edge-Sweeping Brush gets into your edges and corners.; RECHARGES ITSELF SO YOU DON'T HAVE TO. Cleans for up to 120 minutes on a single charge and when its battery is low, this smart robot automatically returns to its charging station to recharge.; A MOP YOU CAN COUNT ON. Dirt and dust disappear thanks to our built-in mop with a micro pump controlling water flow and keeping the mopping pad uniformly moist during cleaning. The washable microfiber mop pad is reusable for up to 30 uses and has three options for mopping water levels.; CUSTOMIZED CLEANING. With 3 levels of suction power plus 3 different water level options for mopping, you get customized cleaning for your floors.; EXTRA DIRT? SPOT CLEANING IS ON IT. Easily target the places where your floors need extra attention. With spot cleaning, your robot spins in place, cleaning in one spot for up to 2 minutes.; FOR PROPER SETUP & OPERATION. The Roomba Combo Essential robot requires a 2.4 GHz network for setup and operation. After setup, keep your robot on 2.4GHz for operation; your phone can return to 5GHz.",206.0,True,True,274.99,590,4.0,Home & Kitchen (Rank: 29366); Robotic Vacuums (Rank: 34),76,29,53,82,348,"Brand: iRobot; Model Name: Essential Combo; Special Feature: Edge Cleaning, Simultaneous Vacumming & Mopping, Eco Mode, Anti-Fall, Auto-Docking; Color: Black; Product Dimensions: 13""L x 13""W x 3.15""H; Included Components: Mop Pad, Battery, Docking Station; Filter Type: Cartridge; Battery Life: 120 minutes; Power Source: Battery Powered; Are Batteries Included: Yes; Control Method: App; Compatible Devices: Amazon Echo; Form Factor: Robotic; UPC: 885155041791; Item Weight: 9.04 pounds; Manufacturer: iRobot; ASIN: B0CVJ3K8FF; Country of Origin: Vietnam; Item model number: Y014020; Batteries: 1 Lithium Ion batteries required. (included); Customer Reviews: 4.0    4.0 out of 5 stars         590 ratings          4.0 out of 5 stars; Best Sellers Rank: #29,366 in Home & Kitchen (See Top 100 in Home & Kitchen) #34 in Robotic Vacuums; Batteries required: Yes",https://www.amazon.com/iRobot-Roomba-Robot-Vacuum-Combo/dp/B0CVJ3K8FF,Home & Kitchen; Vacuums & Floor Care; Vacuums; Robotic Vacuums,True,1.0,Only 1 left in stock - order soon.,,,
B0C2PNWDGZ,"Robot Vacuum Cleaner with 3000Pa Cyclone Suction, APP/Voice/Remote Control, Automatic Self-Charging Robotic Vacuum, Scheduled Cleaning, Ideal for Pet Hair, Hard Floor, Low Carpet Black",Brand: ROPVACNIC,ROPVACNIC,"Are you still tired of cleaning your house manually or worried about pet hair scattered all over the floor?; 【3000Pa Cyclone Cleaning System】ROPVACNIC robot vacuum, fortified with enhanced, hard-hitting suction power, increases the cleaning efficiency by 30%. It proficiently vacuums all dust, pet hair, crumbs, and various debris on multiple surfaces such as hardwood floors, low-pile carpets, etc.; 【Smart APP and Voice Control】Through phone control, you can accomplish your personalized cleaning needs at your fingertips anywhere, anytime, including switching cleaning modes, monitoring the real-time status, setting scheduled cleaning, etc. Moreover, by voice commands, you can clean your home while lying on the couch, enjoying an utterly hands-free cleaning experience(compatible with Alexa or Google Assistant).; 【Cleans Where You Can't 】Measuring at a mere 2.99 inches in height, coupled with a sophisticated sensing system, the mini aspiradora robot effortlessly accesses and cleans under beds, furniture, and other hard-to-reach places. Its dual rotating electric side brushes sweep and collect hidden dust and hair from edges and corners that are often overlooked and neglected.; 【Engineered for Pet Owner】The exclusive no-entanglement design negates the need for your dirty hands to clean up tangled dog or cat hair, unlike traditional roller brushes. A 3-point cleaning system and 600ML optimized larger dust box collects pet hair more efficiently throughout the house, saving you the hassle.; 【Scheduled Cleaning and Self-recharging】Once set, the robot will do the rest on time with zero effort when you are doing about your day. It will automatically start cleaning, obstacle avoidance, easily navigating around your home and returning to the charging station when it's done. The robot will give you a clean home when you step back through the door.; 【Six Cleaning Modes to Meet Your Needs】①Auto Cleaning ②Spot cleaning ③Edge cleaning ④Schedule cleaning ⑤Manual Control ⑥Zigzag cleaning. Tailor the cleaning mode to your needs via ROPVACNIC Smart APP for comprehensive and intelligent cleaning. (Note: Zigzag mode needs to be set on the robotic vacuum cleaner, please refer to the manual.); 【Hassle-free Remote Control Included】Just pick up and start, without the hassle of mobile phones, internet or signal, making it easier to use for you and your family (even teenagers and the elderly). The package contains ROPVACNIC Robot A1, Spare HEPA Filter、Charging Base、Remote Control、Power Adapter 、Self Cleaning Tool、600ML large Dust Box、4 Spare Side Brushes 、Product User Manual、APP Instruction Guide.",94.98,True,True,139.99,76,4.9,Industrial & Scientific (Rank: 1468); Commercial Indoor Robotic Vacuums (Rank: 2),0,0,0,6,69,"Brand: ROPVACNIC; Model Name: A1; Special Feature: ➤Cyclone Suction Power ➤ Intelligent Sensing System➤Automatic Recharging ➤Six Cleaning Modes ➤Anti-collision & Anti-fall➤Tang-free for Pet Hair➤Large-Capacity Batteries Long Runtime ➤Double Electric Rotating Brush ➤Compact and Sturdy Design➤Set Scheduled Cleaning ➤Optimised Filtration System➤600ML Large Dust Box➤Ultra-Quiet Cleaning➤Suitable for Hardwood Floor & Low Pile Carpet; Color: Black; Product Dimensions: 13""L x 13""W x 2.99""H; Included Components: Robotic vacuum cleaner, Charging base, Power adapter, 600ML large dust bin, HEPA filter,4 side brushes, Cleaning brush, User manual, APP instruction; Filter Type: Multi-layer Optimized High-Efficiency Filtration; Battery Life: 100 minutes; Voltage: 7.4 Volts; Capacity: 600 Milliliters; Power Source: Battery Powered; Are Batteries Included: Yes; Control Method: App, Remote, Touch, Voice; Compatible Devices: Smartphones, Alexa, Remote Control, Google Assistant; Form Factor: Round, Robotic,Automatic; Item Weight: 4 pounds; Manufacturer: ROPVACNIC; ASIN: B0C2PNWDGZ; Item model number: A1; Batteries: 1 Lithium Ion batteries required. (included); Customer Reviews: 4.9    4.9 out of 5 stars         76 ratings          4.9 out of 5 stars; Best Sellers Rank: #1,468 in Industrial & Scientific (See Top 100 in Industrial & Scientific) #2 in Commercial Indoor Robotic Vacuums; Date First Available: April 17, 2023; Special Feature: ➤Cyclone Suction Power ➤ Intelligent Sensing System➤Automatic Recharging ➤Six Cleaning Modes ➤Anti-collision & Anti-fall➤Tang-free for Pet Hair➤Large-Capacity Batteries Long Runtime ➤Double Electric Rotating Brush ➤Compact and Sturdy Design➤Set Scheduled Cleaning ➤Optimised Filtration System➤600ML Large Dust Box➤Ultra-Quiet Cleaning➤Suitable for Hardwood Floor & Low Pile Carpet See more",https://www.amazon.com/ROPVACNIC-Automatic-Self-Charging-Scheduled-Cleaning/dp/B0C2PNWDGZ,Home & Kitchen; Industrial & Scientific; Janitorial & Sanitation Supplies; Vacuums & Floor Cleaning Machines; Vacuums; Robotic Vacuums,True,517.0,In Stock,414.0,1658.0,19896.0
B094NYHTMF,"iRobot Roomba j7+ (7550) Self-Emptying Robot Vacuum – Uses PrecisionVision Navigation to Identify & Avoid Objects Like Socks, Shoes, & Pet Waste, Smart Mapping, Self-Empty for Up to 60 Days",Visit the iRobot Store,iRobot,"CLEANS WHEN AND WHERE YOU WANT– Only iRobot brings you Imprint Smart Mapping allowing you to control and schedule which rooms are cleaned and when, while storing multiple maps for easier cleaning on each level of your home.; AVOIDS PET ACCIDENTS – WE GUARANTEE IT - IRobot brings you P.O.O.P. (Pet Owner Official Promise). You can rely on your Roomba j7+ to avoid pet waste, or we’ll replace it for free. Additional terms and conditions apply – see iRobot website for details.; IT DOESN’T JUST LEARN YOUR HOME; IT REACTS TO IT IN REAL TIME. With PrecisionVision Navigation and a camera, your robot identifies and avoids obstacles of all sizes like pet waste, charging cords, socks and shoes to get the whole job done.; MORE THOUGHTFUL THAN YOU THOUGHT - The Roomba j7+ takes vacuuming off your mind with personalized cleaning suggestions powered by the unique intelligence of IRobot OS. Learns your habits and your routines.; POWERFUL PERFORMANCE. The 3-Stage Cleaning System packs 10x the Power-Lifting Suction, an Edge-Sweeping Brush gets along walls and corners, and Dual Multi-Surface Rubber Brushes flex to adjust to different floor types. Compared to the Roomba 600 series.; AUTOMATICALLY EMPTIES ITS BIN ON ITS OWN WITH ENCLOSED BAG SYSTEM - You can forget about vacuuming for months because it empties itself into the Clean Base Automatic Dirt Disposal with enclosed bags. Dust stays out of sight and your hands stay clean.; SPOT CLEANS MESSES THE MOMENT THEY HAPPEN WITHOUT HAVING TO CLEAN THE WHOLE HOUSE - A simple request to your voice assistant or via the IRobot Home App enables the Roomba j7plus to clean messes for you, right when they happen. Works with Google Home and Alexa enabled devices. Alexa and all related logos are trademarks of Amazon or its affiliates. Google is a trademark of Google.; SET TO AUTOMATICALLY CLEAN WHEN YOU'RE AWAY - Now with IRobot OS, you can choose to set your robot to automatically start cleaning when you leave and stop when you come home, so you only notice the clean and never the cleaning.",356.09,True,True,,7797,3.9,Home & Kitchen (Rank: 31387); Robotic Vacuums (Rank: 38),1247,467,467,1013,4600,"Brand: iRobot; Model Name: Roomba j7+; Special Feature: Smart Mapping, Multi-Floor Mapping, Dirt Detection Sensor, Edge Cleaning, Anti-Fall, Scheduling, Pet Hair Pick Up, Auto-Docking, Room-By-Room Navigation, Self-Emptying See more; Color: Roomba J7+; Product Dimensions: 13.3""L x 13.3""W x 3.4""H; Customer Reviews: 3.9    3.9 out of 5 stars         7,797 ratings          3.9 out of 5 stars; Best Sellers Rank: #31,387 in Home & Kitchen (See Top 100 in Home & Kitchen) #38 in Robotic Vacuums; ASIN: B094NYHTMF; Style Number: j755020; Global Trade Identification Number: 10885155026962; UPC: 885155026965; Brand Name: iRobot; Included Components: 1 Extra High-Efficiency Filter, 1 Clean Base® Automatic Dirt Disposal, 1 North American Line Cord, 1 Extra Corner Brush (black), 2 Dirt Disposal Bags, 1 Roomba® j7 Robot Vacuum; Power Source: Battery Powered; Batteries are Included: Yes; Compatible Devices: Smartphones, Amazon Echo, Tablets, Google Home; Form Factor: Robotic; Control Method: App, Touch; Filter Type: Cartridge; Battery Life: 120 minutes; Battery Type: Lithium Ion; Surface Recommendation: Carpet, Hardwood, Hard Surfaces; Special Features: Smart Mapping, Multi-Floor Mapping, Dirt Detection Sensor, Edge Cleaning, Anti-Fall, Scheduling, Pet Hair Pick Up, Auto-Docking, Room-By-Room Navigation, Self-Emptying; Controller Type: Amazon Alexa, Siri, Voice Control; Item Weight: 3.4 Kilograms; Item Dimensions L x W x H: 13.3""L x 13.3""W x 3.4""H",https://www.amazon.com/iRobot-Roomba-Self-Emptying-Robot-Vacuum/dp/B094NYHTMF,Home & Kitchen; Vacuums & Floor Care; Vacuums; Robotic Vacuums,True,62.0,In Stock,,,
B0CYPVS3FF,"Lefant Robot Vacuum M210 Pro, 2200Pa Suction,120 Mins Runtime, Self-Charging Slim Robotic Vacuum Cleaner, APP/Voice/WiFi/Alexa Control, Ideal for Pet Hair,Low-Pile Carpet, Hard Floor Champagne",Visit the Lefant Store,Lefant,"Compact Design: With a slim 2.99"" height, the lefant robot vacuum can easily clean under furnitures,bed and hidden areas for a thorough and efficient cleaning; Suitable for Pet Owners: The vacuum robot efficiently picks up pet hair and dust with 2200 pa suction power from hardwood floors, tiles, and carpets. Used with a brushless suction mouth, it prevents hair from getting tangled; Carpet Boost & Quiet Cleaning: M210 Pro robotic vacuum cleaner intelligently recognizes carpets, automatically increasing suction for optimal performance. Its quite operation would not disturb your babies or pets,making it suitable for use at any hour; Multiple Cleaning Modes: The floor robot vacuum supports six cleaning modes, including zigzag, random, spot, wall, schedule, and manual control. Easily select modes and adjust suction power via the app, offering tailored cleaning options; Upgraded Freemove Technology 3.0: Upgraded infrared-sensor help the robot vacuum cleaner avoid falling downstairs or getting stuckavoid falling downstairs or getting stuck,ensuring a safe and uninterrupted cleaning; Smart APP Control:You can set a schedule cleaning task through the Lefant APP even if you're away and the automatic vacuum cleaner would clean the whole home spotlessly. Most importantly, the vacuum can be activated via voice commands using Amazon Alexa or Google Assistant. Note: Only support 2.4 GHz Wi-Fi and 5 GHz Wi-Fi is not supported; Auto Recharging: For first-time use, please turn on the blue switch button inside it and fully charge it that can provide up to 120 minutes of runtime. M210 Pro automatically return to the charging station when cleaning is complete or battery is low. Note:Cannot charge when product is turned off; What's Included: Robo vacuum M210P, charging station, power adapter,2 side brushes,dustbin, 2 HEPA filters, 1 cleaning tool and user manual",209.99,True,True,209.99,3178,4.2,Home & Kitchen (Rank: 103471); Robotic Vacuums (Rank: 105),286,158,222,572,1970,"Brand: Lefant; Model Name: M210P; Special Feature: Edge Cleaning, Scheduling, Pet Hair Pick Up, Obstacle Avoidance, Boost-Intellect Technology; Color: Champagne; Product Dimensions: 11""L x 11""W x 2.99""H; Manufacture Year: 2024; Customer Reviews: 4.2    4.2 out of 5 stars         3,178 ratings          4.2 out of 5 stars; Best Sellers Rank: #103,471 in Home & Kitchen (See Top 100 in Home & Kitchen) #105 in Robotic Vacuums; ASIN: B0CYPVS3FF; Style Number: M210P; UPC: 780627998828; Brand Name: Lefant; Included Components: 1 * Lefant M210P Robotic Vacuum Cleaner, 1 * 19V/0.6A Adapter, 4 * Side Brushes, 1 * Charging Dock, 2 * HEPA Filter; Power Source: Battery Powered; Batteries are Included: Yes; Capacity: 500 Milliliters; Compatible Devices: Smartphones, Amazon Echo, Tablets, Google Home; Form Factor: Robotic; Control Method: App, Remote, Voice; Filter Type: Foam, Sponge, HEPA; Battery Life: 2  years; Battery Type: Lithium Ion; Surface Recommendation: Wood, Hard Floors and Low Pile Carpet; Special Features: Edge Cleaning, Scheduling, Pet Hair Pick Up, Obstacle Avoidance, Boost-Intellect Technology; Controller Type: Alexa Control, Remote Control, App Control, Voice Control; Item Dimensions L x W x H: 11""L x 11""W x 2.99""H",https://www.amazon.com/Lefant-Cleaner-Suction-Self-Charging-Low-Pile/dp/B0CYPVS3FF,Home & Kitchen; Vacuums & Floor Care; Vacuums; Robotic Vacuums,True,3.0,In Stock,,,
B0CWQP4Y4R,"roborock Q5 Max+ Robot Vacuum with Self-Empty Dock, Upgraded from Q5+, 5500 Pa Suction, DuoRoller Brush, Hands-Free Cleaning for up to 7 Weeks, PreciSense LiDAR Navigation, App & Voice Control",Visit the roborock Store,roborock,"7-Week Hands-Free Cleaning: Experience the convenience of self-emptying with 2x2.5L dust bags, allowing you to go up to 7 weeks without manual trash disposal. Made from high-efficiency material, the dust bags help reduce dust, contributing to a cleaner home environment.; 5500 Pa Effortless Suction: Featuring 5500 Pa HyperForce suction power, the Q5 Max+ captures dust and debris from various types of flooring, including hardwood, tile, and carpet, for effective cleaning. Paired with the advanced DuoRoller Brush, it efficiently cleans dirt, pet hair, and human hair, with a design that helps reduce tangling.; PreciSense LiDAR Navigation System: Creating detailed 3D maps for quick and accurate navigation. With a quick mapping feature and multi-level mapping system, it adapts seamlessly to different environments, ensuring thorough and efficient cleaning every time.; Cleaning in One Step: The Q5 Max+ has a 770ml dustbin capacity, a maximum sweeping area of 3,767 sqft, and can run for up to 240 minutes on a single charge, making it easy to turn on and off to meet the sweeping needs of most households.; Voice & APP Control: Forget about manual commands and embrace voice and app control. Q5 Max+ syncs seamlessly with Alexa, Apple Siri, and Google Home, so all you have to do is say the magic word. By simply using your voice and figures you can initiate cleaning or adjust settings effortlessly.; What’s in the Box: Q5 Max+ Robot Vacuum, Auto-Empty Dock, Power Cable, Dustbin, Dust Bag x 2, Side Brush x 1, User Manual.",449.99,True,True,449.99,2457,4.2,Home & Kitchen (Rank: 12394); Robotic Vacuums (Rank: 17),270,98,122,319,1621,"Brand: roborock; Model Name: Q5 Max+; Special Feature: Smart Mapping, DuoRoller Brush, PreciSense LiDAR Navigation, 5500 Pa Suction, Self-Emptying; Color: Black; Product Dimensions: 13.8""L x 17.3""W x 16.7""H; Included Components: Q5 Max+ Robot Vacuum, Self-Empty Station, Power Cable, Dustbin, Dust Bag x 2, Side Brush x 1, User Manual; Filter Type: Washable; Battery Life: 240 minutes; Voltage: 120 Volts; Capacity: 0.77 Liters; Power Source: Battery Powered; Are Batteries Included: Yes; Control Method: App, Voice; Compatible Devices: Smartphones, Amazon Echo, Google Home; Form Factor: Robotic; Global Trade Identification Number: 00195043004907; Manufacture Year: 2024; Item Weight: 16 pounds; Manufacturer: roborock; ASIN: B0CWQP4Y4R; Country of Origin: China; Item model number: Q5 Max Plus; Batteries: 1 Lithium Ion batteries required. (included); Customer Reviews: 4.2    4.2 out of 5 stars         2,457 ratings          4.2 out of 5 stars; Best Sellers Rank: #12,394 in Home & Kitchen (See Top 100 in Home & Kitchen) #17 in Robotic Vacuums; Specific instructions for use: robot vacuum for carpet, hardwood floor, Floor cleaning, Pet hair, robotic vacuum cleaner for home; Batteries required: Yes",https://www.amazon.com/roborock-Q5-Max-Self-Empty-Hands-Free/dp/B0CWQP4Y4R,Home & Kitchen; Vacuums & Floor Care; Vacuums; Robotic Vacuums,True,5.0,In Stock,348.0,1393.0,16716.0
