B0CTY6VT8Y,"eufy Robot Vacuum Omni S1 Pro with All-in-One Station, Floor Washing Robot Vacuum and Mop, Eco-Clean Ozone, 8000 Pa Suction, Obstacle Avoidance, Auto Mop Washing & Drying, Self-Emptying",Visit the eufy Store,eufy,"Groundbreaking Floor Washing System: Introducing the revolutionary Floor Washing System, equipped with an Always Clean Mop and a dual water reservoir loaded with ozonated water. The 11.4-inch mop refreshed itself in real-time at 170 RPM, ensuring all-around cleanliness by removing even invisible dirt. And with 1 kg of downward pressure, S1 Pro mimics meticulous hand scrubbing to effectively remove stubborn stains*. *We do not recommend cleaning large amounts of liquid waste, as there is a risk of damaging the robot.; 10-in-1 UniClean Station: Offers auto emptying, auto washing, auto refilling, auto heated air drying, Eco-Clean Ozone, auto waste water collection, auto detergent dispensing, LCD touch control, sealed dust bag and 20% faster charging*. Enjoy hassle-free cleaning with this 10-in-1 powerhouse, for automated and effortless maintenance. *Based on eufy internal test, 20% faster charging compared to the previous generation product.; 8,000 Pa Potent Suction: 8,000 Pa potent suction empowers deep cleaning on carpets and hard floors, effortlessly removing hair and deep-seated dirt*. *Actual performance may vary based on the floor type and dust level.; Constructed for Corner-to-Edge Cleaning: S1 Pro's sleek square design ensures it effortlessly reaches hard-to-reach areas like edges and corners for a thorough deep clean.; The Sports Car Streamlined Build: Inspired by the sleek and graceful lines of elite sports cars, this is more than just a home appliance; it also elevates your living space.; [Note]: Make sure you are using a 2.4GHz router or a dual-band router that is configured to support a 2.4GHz frequency band. RoboVac does not support 5GHz frequency band.",1499.99,True,True,,182,4.4,Home & Kitchen (Rank: 171486); Robotic Vacuums (Rank: 168),14,5,12,18,131,"Brand: eufy; Model Name: eufy Robot Vacuum Omni S1 Pro; Special Feature: 8,000 Pa Potent Suction, 10-in-1 UniClean Station, Precision Corner to Edge Clean, 3D MatrixEye Obstacle Avoidance, Always Clean Mop; Color: Black; Product Dimensions: 18.39""L x 15.08""W x 26.38""H; Included Components: 1 x Robotic vacuum cleaner, 2 sets Side brush,1x rolling mop, 1x dust bag, 1 x Safety book, 1 x Hard Floor Cleaner, 1x All-in-One Station; Filter Type: washable; Battery Life: 136 minutes; Capacity: 2.5 Liters; Power Source: Battery Powered; Are Batteries Included: Yes; Control Method: App; Compatible Devices: Smartphones, Amazon Echo, Google Home; Form Factor: Robotic; Global Trade Identification Number: 00194644197704; UPC: 194644197704; Item Weight: 30.4 pounds; Manufacturer: eufy; ASIN: B0CTY6VT8Y; Country of Origin: China; Item model number: T2080; Batteries: 1 Lithium Ion batteries required. (included); Customer Reviews: 4.4    4.4 out of 5 stars         182 ratings          4.4 out of 5 stars; Best Sellers Rank: #171,486 in Home & Kitchen (See Top 100 in Home & Kitchen) #168 in Robotic Vacuums; Number of pieces: 1; Batteries required: Yes; Special Feature: 8,000 Pa Potent Suction, 10-in-1 UniClean Station, Precision Corner to Edge Clean, 3D MatrixEye Obstacle Avoidance, Always Clean Mop See more",https://www.amazon.com/eufy-Station-Obstacle-Avoidance-Self-Emptying/dp/B0CTY6VT8Y,Home & Kitchen; Vacuums & Floor Care; Vacuums; Robotic Vacuums,True,5.0,In Stock,,,
B0CFDXCVK3,"Robot Vacuum and Mop Combo, 2 in 1 Mopping Robot Vacuum Cleaner with Schedule, Wi-Fi/Voice/App, Strong Suction, Ease of Use, Self-Charging Robotic Vacuum, Slim, Ideal for Hard Floor, Pet Hair, Carpet Brown",Visit the MAMNV Store,MAMNV,"2-In-1 Mopping Robot Vacuum: 1400Pa Max suction, 2 suction levels robot vacuum cleaner can quickly remove dust, paper, hair and other garbage. Intelligent mopping function and electric control water tank, 2 levels of full penetration, suitable for all hard floors, such as laminate, ceramic tiles, granite, parquet, etc; Smart App, Voice Control: With the Tuya Smart app, setting up cleaning schedule, adjusting cleaning modes, directions, and checking error reasons.The robot vacuum is also compatible with Google Assistant, allowing users to make the robotic vacuum start and stop the clean by voice commands.It is friendly to both beginners in smart products and elderly. (⚠The APP only supports 2. 4GHz WiFi.); Obstacle Avoidance, Lightweight Cons: The robot vacuum and mop has advanced 3D precise obstacle avoidance function, a full set of sensors can intelligently identify and avoid white walls, stairs, and obstacles. 2.87'' slim design helps robot mop to reach every corner of a house or narrow space, achieving maximum cleaning coverage, and keep your house neat; 4 High-Efficiency Cleaning Modes: The robot vacuum and mop combo can be flexibly switched between different modes through the remote control or APP (Auto/Spot /Edge/Zig-zag cleaning) to meet the different cleaning needs of the family. Among them, the zigzag path can cover the largest area for cleaning, reduce missed scanning, and increase efficiency by 30%; 100mins Runtime, Self Recharge: With 2500mAh battery capacity, supporting 100-220V voltage, robot vacuum cleaner can work continuously for 100 minutes in a 1290 sqft house, and will automatically back to the charging base to charge, when the battery is low or finished cleaning.(When the robotic vacuum cleaner is charging normally, the indicator light flashes green); Advanced Non-Rolling Brush, Ultra Low Decibel: The robot vacuum cleaner adopts a powerful digital motor and a unique air intake design, which will not be blocked by hair like robotic vacuum with rolling brush. The combination of 1400Pa strong suction and ultra-low 60 decibel technology is an ideal for pet families and also keep babies from noise besetment",229.9,True,True,269.98,2310,4.4,Home & Kitchen (Rank: 9294); Robotic Vacuums (Rank: 13),138,92,115,231,1732,"Brand: MAMNV; Model Name: BR151 Robot Vacuum and Mop Combo; Special Feature: Variable Suction Control, Wet/Dry, Simultaneous Vacuuming & Mopping, Scheduling, Pet Hair Pick Up; Color: Brown; Product Dimensions: 11.8""L x 11.8""W x 2.87""H; Included Components: 1x Charging Dock,1x Remote Control, 1x Watertank(With Washable Mopping Cloth), 2x Side Brush, 1x User Manual,1x FQA,1x Networking Guide, 1x Power Adapter; Filter Type: High Efficiency Filter, Foam; Battery Life: 1000 Hours; Voltage: 220 Volts; Capacity: 450 Milliliters; Power Source: Battery Powered; Are Batteries Included: Yes; Control Method: App, Remote, Touch, Voice; Compatible Devices: Smartphones, Amazon Echo, Google Home; Form Factor: Robotic; Item Weight: 5.73 pounds; Manufacturer: MAMNV; ASIN: B0CFDXCVK3; Item model number: BR151 Robot Vacuum and Mop Combo; Batteries: 1 Lithium Ion batteries required. (included); Customer Reviews: 4.4    4.4 out of 5 stars         2,310 ratings          4.4 out of 5 stars; Best Sellers Rank: #9,294 in Home & Kitchen (See Top 100 in Home & Kitchen) #13 in Robotic Vacuums; Date First Available: August 11, 2023; Special Feature: Variable Suction Control, Wet/Dry, Simultaneous Vacuuming & Mopping, Scheduling, Pet Hair Pick Up See more",https://www.amazon.com/MAMNV-Robot-Vacuum-Mop-Combo/dp/B0CFDXCVK3,Home & Kitchen; Vacuums & Floor Care; Vacuums; Robotic Vacuums,True,5.0,In Stock,461.0,1846.0,22152.0
B0DBLQBZJD,"Robot Vacuum Cleaner,2900Pa Suction Power, 120 Mins Runtime,Self-Charging Robot Vacuum for Low Carpet, Pet Hair, Hard Floors",Visit the ENCHE Store,ENCHE,"【ULTRA-POWERFUL SUCTION】Experience unmatched cleaning performance with 2900Pa of ultra-powerful suction. This robot vacuum cleaner easily lifts dust, debris, and pet hair from hard floors and low-pile carpets, making it a top choice for maintaining an immaculate home. It's great for cleaning both short and medium-pile carpets, as well as hardwood floors; 【2.99 INCHES SLIM】Standing at just 2.99 inches tall, this vacuum robot cleaner slides effortlessly under beds, furniture, and into tight spaces. Equipped with advanced navigation, it reaches hidden spot, collecting dust and pet dog hair from edges and corners. It's an essential robotic vacuum for thorough cleaning; 【SMART NAVIGATION & ANTI-FALL】 This robot vacuum pet hair hard floor cleaner navigates around walls, stairs, and obstacles, tangle free,preventing falls and collisions. It can even climb slopes up to 15°, performing effectively on both hardwood floors and low-pile carpets; 【LONG BATTERY LIFE & AUTO-CHARGING】With a powerful battery, this auto vacuum offers up to 120 minutes of continuous cleaning, covering up to 1300 sq. ft. When the battery is low or cleaning is complete, it automatically returns to its charging dock, ensuring it's always ready for the next use; 【MULTIPLE CLEANING MODES】Enjoy various cleaning options with this robot vacuum cleaner, featuring modes like Manual Cleaning, Spot Cleaning, Edge Cleaning, and Auto mode, all accessible via remote control; NOTES:ENCHE Robot Vacuum Cleaner can't be compatible Amazon Echo device",,True,True,,3,3.0,Home & Kitchen (Rank: 1097750); Robotic Vacuums (Rank: 956),1,0,0,0,1,"Brand: ENCHE; Model Name: 803; Special Feature: Anti-Collision, Anti-Fall,Auto-Docking ,Super-Thin, Quiet,Washable HEPA Filtration,Auto Vacuum,Self Charging,Remote Control ,Super Thin See more; Color: White; Product Dimensions: 12""L x 12""W x 2.99""H; Customer Reviews: 3.0    3.0 out of 5 stars         3 ratings          3.0 out of 5 stars; Best Sellers Rank: #1,097,750 in Home & Kitchen (See Top 100 in Home & Kitchen) #956 in Robotic Vacuums; ASIN: B0DBLQBZJD; Style Number: 803; Brand Name: ENCHE; Included Components: 1 x Remote Control, 1 x cleaning brush; 1 x user manual;, 1 x dust bin with 1 pre-filter & 1 HEPA filter;, 1 x Robotic Vacuum; 1 x charging dock;, 1 x power adapter; 2 pairs of brushes;; Power Source: Battery Powered; Batteries are Included: Yes; Voltage: 14.8 Volts; Capacity: 200 Milliliters; Compatible Devices: Amazon Echo; Form Factor: Robotic; Control Method: Remote; Filter Type: Sponge; Battery Life: 120 minutes; Battery Type: Lithium Ion; Surface Recommendation: Wood,Hard Floor,Low Carpet; Special Features: Anti-Collision, Anti-Fall,Auto-Docking ,Super-Thin, Quiet,Washable HEPA Filtration,Auto Vacuum,Self Charging,Remote Control ,Super Thin; Controller Type: Remote Control; Item Dimensions L x W x H: 12""L x 12""W x 2.99""H",https://www.amazon.com/ENCHE-Cleaner-Suction-Runtime-Self-Charging/dp/B0DBLQBZJD,Home & Kitchen; Vacuums & Floor Care; Vacuums; Robotic Vacuums,,,,,,
B0BXNNYJ7Q,"Shark AV2310AE Matrix Self-Emptying Robot Vacuum with No Spots Missed on Carpets and Hard Floors, Precision Home Mapping, Perfect for Pet Hair, Bagless, 45-Day Capacity Base, Wi-Fi Black/Brass",Visit the Shark Store,Shark,"LEAVES NO SPOTS MISSED: With Matrix Clean, the robot vacuum cleans using a precision grid taking multiple passes over dirt and debris for deep cleaning coverage.; INCREDIBLE SUCTION: Powerful suction captures dirt and debris on carpets and hardwood floors tackling even the toughest of messes in your home.; EMPTIES ITSELF: Self-empties after each clean into a bagless base that holds up to 45 days of dirt and debris. The bagless base does not require any additional purchase of disposal bags like traditional auto empty robots.; MULTI SURFACE CLEANING: Multi-surface brushroll combs and pulls debris, hair, and dirt from all the surfaces in your home including carpets and hard floors.; PRECISION HOME MAPPING: 360° LiDAR vision quickly and accurately maps your home so your robot can methodically clean detecting and avoiding objects in its path, day, or night, adapting to everyday changes in the home.; PERFECT FOR HOMES WITH PETS: Powerful vacuum suction and multi-surface brushroll help capture pet hair, dust, and dander.; ADVANCED TARGETED CLEANING: With a tap in the SharkClean app you can target rooms and spots with Matrix Clean for 30% better cleaning on carpets and hard floors (vs. AV2310AE single pass tested on level loop sand).; CLEANING CUSTOMIZATION: Creates a precise home map in the SharkClean app so you can select specific areas to clean on-demand, initiate Matrix Clean, and set cleaning schedules from anywhere.; CONVENIENT HANDS FREE-CLEANING: Voice control activates cleaning the whole home, a room, or a spot through the app or using voice control. With Recharge & Resume, when low on battery, the robot will recharge, and pickup cleaning where it left off.; WHAT'S INCLUDED: Shark Matrix Robot, Self-Empty Base, and 1 Side Brush.",249.0,True,True,449.99,261,3.7,Home & Kitchen (Rank: 69281); Robotic Vacuums (Rank: 76),54,15,13,44,133,"Brand: Shark; Model Name: Shark AV2310AE; Special Feature: Spotless Cleaning, High Precision Sensors, Lightweight, Wheels, Bagless; Color: Black/Brass; Product Dimensions: 13.39""L x 13.39""W x 4.19""H; Customer Reviews: 3.7    3.7 out of 5 stars         261 ratings          3.7 out of 5 stars; Best Sellers Rank: #69,281 in Home & Kitchen (See Top 100 in Home & Kitchen) #76 in Robotic Vacuums; ASIN: B0BXNNYJ7Q; Style Number: AV2310AE; UPC: 622356604840; Brand Name: Shark; Included Components: 1 Side Brush, Shark Matrix Robot, Self-Empty Base; Power Source: Battery Powered; Batteries are Included: Yes; Voltage: 4 Volts; Capacity: 45 days; Compatible Devices: Amazon Echo; Form Factor: Robotic; Filter Type: washable (pre-motor filter, cold water only); Battery Life: 30 days; Battery Type: Lithium Ion; Surface Recommendation: Carpet & Hard Floors; Special Features: Spotless Cleaning, High Precision Sensors, Lightweight, Wheels, Bagless; Controller Type: App Control; Item Weight: 13.23 Pounds; Item Dimensions L x W x H: 13.39""L x 13.39""W x 4.19""H",https://www.amazon.com/Shark-AV2310AE-Self-Emptying-Precision-Capacity/dp/B0BXNNYJ7Q,Home & Kitchen; Vacuums & Floor Care; Vacuums; Robotic Vacuums,True,3.0,In Stock,,,
B09NM5JQ94,"roborock Q7 Max Robot Vacuum and Mop Cleaner, 4200Pa Strong Suction, Lidar Navigation, Multi-Level Mapping, No-Go&No-Mop Zones, 180mins Runtime, Works with Alexa, Perfect for Pet Hair(Black)",Visit the roborock Store,roborock,"Deeper Cleaning with Powerful 4200 Pa Suction: With an incredible maximum suction power of 4200 Pa, the Q7 Max easily lifts debris and pet hair from floors, drags it from cracks, and draws it from carpets. When a carpet is detected, it will automatically increase its suction to the maximum for deep cleaning.; Vacuum and Mop Simultaneously: To get rid of fine dust that vacuuming alone might miss, the Q7 Max can vacuum and mop simultaneously. Equipped with an electronic pump, the Q7 Max offers 30 water flow levels so you can fine-tune cleaning to match your floor types and preferences.; Clean Smarter with PreciSense LiDAR Navigation: LiDAR navigation, which is incredibly accurate, can now be viewed in 3D, building precise maps of your home. It also monitors cleaning routes efficiently. You can virtually recreate your home by adding furnishings and flooring materials.; Combined Dustbin & Water Tank: Combining the 470 ml dustbin and 350 ml water tank means that you can clean more often without worrying about emptying or refilling.; Multi-directional Floating All-Rubber Brush: An all-rubber brush strongly resists hair tangles making it ideal for tackling long hair and pet hair. Multi-directional design means the brush can be closer to the floor to provide deeper and more efficient cleaning.; Long-Lasting Cleaning: The Q7 Max can run for up to 180 minutes on a single charge with a specially designed battery, or for a maximum vacuuming area of 3229 square sqft.; 2.4G Wi-Fi Connectivity for Seamless Control: The Q7 Max robot vacuum cleaner supports 2.4G Wi-Fi, ensuring a stable and reliable connection. Easily control and monitor your robotic vacuum cleaner through the app, schedule cleaning sessions, and receive updates from anywhere in your home.",219.99,True,True,599.99,724,4.3,Home & Kitchen (Rank: 5329); Robotic Vacuums (Rank: 10),65,28,36,101,492,"Brand: roborock; Model Name: Q7 Max; Special Feature: LiDAR Navigation, Simultaneous Vacumming & Mopping, Powerful 4200Pa Suction, Combined 470 ml Dustbin & 350 ml Water Tank, App Control: Variable Suction Control, Multi-Floor Mapping, No-Go Zone, Scheduling; Voice Control, Pet Hair Pick Up, Works with Alexa, Anti-Fall, Cordless, Edge Cleaning, Precision Laser Mapping & Navigation, Auto-Docking; Color: Black; Product Dimensions: 13.9""L x 13.8""W x 3.8""H; Included Components: Q7 Max Robot Vacuum (1) Dustbin & Water Tank (1) Moisture-Proof Mat (1) Mop Cloth Mount (1) Mop Cloth (1) Charging Dock (1) Power Cable (1) User Manual (1); Filter Type: Washable Filter; Battery Life: 180 minutes; Capacity: 350 Milliliters; Power Source: Battery Powered; Are Batteries Included: Yes; Control Method: App, Touch, Voice; Compatible Devices: Smartphones, Amazon Echo, Google Home; Form Factor: Robotic; Global Trade Identification Number: 00810074998208; Item Weight: 8 pounds; Manufacturer: Roborock; ASIN: B09NM5JQ94; Country of Origin: China; Item model number: Q7Max; Batteries: 1 Lithium Ion batteries required. (included); Customer Reviews: 4.3    4.3 out of 5 stars         724 ratings          4.3 out of 5 stars; Best Sellers Rank: #5,329 in Home & Kitchen (See Top 100 in Home & Kitchen) #10 in Robotic Vacuums; Date First Available: December 14, 2021; Special Feature: LiDAR Navigation, Simultaneous Vacumming & Mopping, Powerful 4200Pa Suction, Combined 470 ml Dustbin & 350 ml Water Tank, App Control: Variable Suction Control, Multi-Floor Mapping, No-Go Zone, Scheduling; Voice Control, Pet Hair Pick Up, Works with Alexa, Anti-Fall, Cordless, Edge Cleaning, Precision Laser Mapping & Navigation, Auto-Docking See more",https://www.amazon.com/Roborock-Q7-Max-Navigation-Multi-Level/dp/B09NM5JQ94,Home & Kitchen; Vacuums & Floor Care; Vacuums; Robotic Vacuums,True,118.0,In Stock,877.0,3511.0,42132.0
B0DBT9KTFY,"ECOVACS DEEBOT T30S Care Robot Vacuum and Mop, 11000Pa, ZeroTangle Technology, TruEdge Adaptive Edge Mopping, Hot Water Mop Washing, Self-Emptying, Self Refilling, Auto-Mop Lifting, Obstacle Avoidance T30S CARE Black",Visit the ECOVACS Store,ECOVACS,"Unbeatable 11,000Pa Suction Power Experience a new level of clean with the DEEBOT T30S Care. Its powerful 11,000Pa suction, driven by advanced motor and airflow technology, makes cleaning carpets effortless. Enjoy spotless floors throughout your home, without the hassle.; ZeroTangle Anti-Tangle Technology Say goodbye to detangling hair and debris. Equipped with ZeroTangle technology, the DEEBOT T30S Care masterfully avoids entanglements of both human and pet hair on the main brush. This breakthrough minimizes maintenance, ensures a smooth, continuous and efficient cleaning.; TruEdge Adaptive Edge Mopping Equipped with TruEdge Technology, the DEEBOT T30S Care excels in cleaning edges and corners with unparalleled precision. By employing a hovering arm and advanced algorithms, it achieves 1mm accuracy and significantly enhances 99% coverage in hard-to-reach areas. No spot is left untouched.; All-in-One OMNI Station The all-in-one OMNI station supports 158℉ hot-water mop washing, self-emptying, auto water refilling and hot-air drying. This multi-functional station prepares your DEEBOT T30S Care for any cleaning challenge, embodying the essence of convenience and readiness.; Advanced Navigation and Obstacle Avoidance Experience a thorough and uninterrupted clean with the DEEBOT T30S Care. TrueDetect 3D 3.0 avoids obstacles with precision, while TrueMapping 2.0 maps your home quickly. This intelligent combination ensures efficient cleaning with minimal risk of getting stuck or damaging furniture.; Effortless Cleaning Control Control your DEEBOT with ease Use voice commands (‘OK YIKO‘) or a simple foot touch to start cleaning. Works across Apple Watch, and Smartphone Widgets and Dynamic Island for seamless control from anywhere. Alexa is also supported. No more hunting for your phone; Intelligent Deep Mopping Mop Rewashing and Remopping. The DEEBOT T30S Care tackles even the stickiest dirt; Long-Lasting Battery and Fast Charging With up to 180 minutes of runtime",1029.99,True,True,1029.99,1195,4.3,Home & Kitchen (Rank: 35246); Robotic Vacuums (Rank: 43),107,35,59,143,836,"Brand: ECOVACS; Model Name: DEEBOT T30S Care; Special Feature: 11000Pa Unbeatable Suction, Innovative ZeroTangle Technology, Upgraded All-in-One Station, TruEdge Adaptive Edge Mopping Technology, 158℉ Hot Water Mop Washing; Color: Black; Product Dimensions: 15.51""L x 17.44""W x 20.76""H; Included Components: Washiable mopping pads*2, OMNI station*1, User Manual*1, Mopping Kits*2, T30S Robot Vacuum*1; Filter Type: Washable; Battery Life: 180 minutes; Voltage: 110 Volts; Power Source: Battery Powered; Are Batteries Included: Yes; Compatible Devices: Smartphones, Amazon Echo, Google Home, Smartwatches; Form Factor: Robot Vacuum Cleaner; UPC: 850058335995; Manufacture Year: 2023; Item Weight: 32.8 pounds; Manufacturer: ECOVACS; ASIN: B0DBT9KTFY; Country of Origin: China; Item model number: DEEBOT T30S Care; Batteries: 1 Lithium Ion batteries required. (included); Customer Reviews: 4.3    4.3 out of 5 stars         1,195 ratings          4.3 out of 5 stars; Best Sellers Rank: #35,246 in Home & Kitchen (See Top 100 in Home & Kitchen) #43 in Robotic Vacuums; Batteries required: Yes; Special Feature: 11000Pa Unbeatable Suction, Innovative ZeroTangle Technology, Upgraded All-in-One Station, TruEdge Adaptive Edge Mopping Technology, 158℉ Hot Water Mop Washing See more",https://www.amazon.com/ECOVACS-DEEBOT-T30S-Care-Self-Emptying/dp/B0DBT9KTFY,Home & Kitchen; Vacuums & Floor Care; Vacuums; Robotic Vacuums,True,999.0,In Stock,,,
